A1: 7/20/2024 Landisville, Pennsylvania
C2: General Effect | F2: Visual | J2: Music
C3: 1 | D3: 2 | F3: Proficiency | G3: Analysis | H3: Color Guard | J3: Brass | K3: Analysis | L3: Percussion | N3: Sub | P3: Total
C4: T. Fox | D4: D. Orser | E4: Total | F4: C. Raichle | G4: M. Thompson | H4: T. Wingate | I4: Total ÷2 | J4: C. Marra | K4: G. Howarth | L4: T. Mengel | M4: Total ÷2 | N4: Total | O4: Pen | P4: Score
A5: DCI Open Class | C5: 20 | D5: 20 | E5: 40 | F5: 20 | G5: 20 | H5: 20 | I5: 30 | J5: 20 | K5: 20 | L5: 20 | M5: 30 | N5: 100 | P5: 100
A6: Raiders | B6: 1 | C6: 12.40 | D6: 12.70 | E6: 25.10 | F6: 12.80 | G6: 12.70 | H6: 12.00 | I6: 18.75 | J6: 13.60 | K6: 12.70 | L6: 10.90 | M6: 18.60 | N6: 62.45 | O6: 0.0 | P6: 62.45
C7: 1 | D7: 1 | E7: 1 | F7: 1 | G7: 1 | H7: 1 | I7: 1 | J7: 1 | K7: 1 | L7: 1 | M7: 1 | N7: 1 | P7: 1
A8: DCI All Age World Class
A9: Reading | B9: 3 | C9: 17.80 | D9: 17.70 | E9: 35.50 | F9: 17.20 | G9: 17.80 | H9: 17.30 | I9: 26.15 | J9: 17.10 | K9: 17.70 | L9: 17.80 | M9: 26.30 | N9: 87.95 | O9: 0.0 | P9: 87.95
A10: Buccaneers | C10: 1 | D10: 1 | E10: 1 | F10: 1 | G10: 1 | H10: 1 | I10: 1 | J10: =RANK(J9,(J$6,J$9,J$11,J$13,J$16,J$18,J$21,J$23,J$25,J$27,J$29,J$31,J$33,J$35,J$37,J$39,J$41,J$43,J$45,J$47,J$49,J$51,J$53,J$55,J$57,J$59,J$61,J$63,J$65,J$67,J$69,J$71,J$73,J$75,J$77,J$79,J$81,J$83,J$85,J$87,J$89,J$91,J$93,J$95,J$97,J$99,J$101,J$103,J$105,J$107,J$109,J$111,J$113,J$115,J$117,J$119,J$121,J$123,J$125,J$127)) -> 1 | K10: =RANK(K9,(K$6,K$9,K$11,K$13,K$16,K$18,K$21,K$23,K$25,K$27,K$29,K$31,K$33,K$35,K$37,K$39,K$41,K$43,K$45,K$47,K$49,K$51,K$53,K$55,K$57,K$59,K$61,K$63,K$65,K$67,K$69,K$71,K$73,K$75,K$77,K$79,K$81,K$83,K$85,K$87,K$89,K$91,K$93,K$95,K$97,K$99,K$101,K$103,K$105,K$107,K$109,K$111,K$113,K$115,K$117,K$119,K$121,K$123,K$125,K$127)) -> 1 | L10: =RANK(L9,(L$6,L$9,L$11,L$13,L$16,L$18,L$21,L$23,L$25,L$27,L$29,L$31,L$33,L$35,L$37,L$39,L$41,L$43,L$45,L$47,L$49,L$51,L$53,L$55,L$57,L$59,L$61,L$63,L$65,L$67,L$69,L$71,L$73,L$75,L$77,L$79,L$81,L$83,L$85,L$87,L$89,L$91,L$93,L$95,L$97,L$99,L$101,L$103,L$105,L$107,L$109,L$111,L$113,L$115,L$117,L$119,L$121,L$123,L$125,L$127)) -> 1 | M10: =RANK(M9,(M$6,M$9,M$11,M$13,M$16,M$18,M$21,M$23,M$25,M$27,M$29,M$31,M$33,M$35,M$37,M$39,M$41,M$43,M$45,M$47,M$49,M$51,M$53,M$55,M$57,M$59,M$61,M$63,M$65,M$67,M$69,M$71,M$73,M$75,M$77,M$79,M$81,M$83,M$85,M$87,M$89,M$91,M$93,M$95,M$97,M$99,M$101,M$103,M$105,M$107,M$109,M$111,M$113,M$115,M$117,M$119,M$121,M$123,M$125,M$127)) -> 1 | N10: =RANK(N9,(N$6,N$9,N$11,N$13,N$16,N$18,N$21,N$23,N$25,N$27,N$29,N$31,N$33,N$35,N$37,N$39,N$41,N$43,N$45,N$47,N$49,N$51,N$53,N$55,N$57,N$59,N$61,N$63,N$65,N$67,N$69,N$71,N$73,N$75,N$77,N$79,N$81,N$83,N$85,N$87,N$89,N$91,N$93,N$95,N$97,N$99,N$101,N$103,N$105,N$107,N$109,N$111,N$113,N$115,N$117,N$119,N$121,N$123,N$125,N$127)) -> 1 | P10: =RANK(P9,(P$6,P$9,P$11,P$13,P$16,P$18,P$21,P$23,P$25,P$27,P$29,P$31,P$33,P$35,P$37,P$39,P$41,P$43,P$45,P$47,P$49,P$51,P$53,P$55,P$57,P$59,P$61,P$63,P$65,P$67,P$69,P$71,P$73,P$75,P$77,P$79,P$81,P$83,P$85,P$87,P$89,P$91,P$93,P$95,P$97,P$99,P$101,P$103,P$105,P$107,P$109,P$111,P$113,P$115,P$117,P$119,P$121,P$123,P$125,P$127)) -> 1
A11: Bushwackers | B11: 2 | C11: 17.30 | D11: 17.10 | E11: 34.40 | F11: 16.70 | G11: 17.30 | H11: 17.10 | I11: 25.55 | J11: 16.00 | K11: 17.00 | L11: 17.70 | M11: 25.35 | N11: 85.30 | O11: 0.0 | P11: 85.30
C12: 2 | D12: 2 | E12: 2 | F12: 3 | G12: 2 | H12: 2 | I12: 2 | J12: =RANK(J11,(J$6,J$9,J$11,J$13,J$16,J$18,J$21,J$23,J$25,J$27,J$29,J$31,J$33,J$35,J$37,J$39,J$41,J$43,J$45,J$47,J$49,J$51,J$53,J$55,J$57,J$59,J$61,J$63,J$65,J$67,J$69,J$71,J$73,J$75,J$77,J$79,J$81,J$83,J$85,J$87,J$89,J$91,J$93,J$95,J$97,J$99,J$101,J$103,J$105,J$107,J$109,J$111,J$113,J$115,J$117,J$119,J$121,J$123,J$125,J$127)) -> 3 | K12: =RANK(K11,(K$6,K$9,K$11,K$13,K$16,K$18,K$21,K$23,K$25,K$27,K$29,K$31,K$33,K$35,K$37,K$39,K$41,K$43,K$45,K$47,K$49,K$51,K$53,K$55,K$57,K$59,K$61,K$63,K$65,K$67,K$69,K$71,K$73,K$75,K$77,K$79,K$81,K$83,K$85,K$87,K$89,K$91,K$93,K$95,K$97,K$99,K$101,K$103,K$105,K$107,K$109,K$111,K$113,K$115,K$117,K$119,K$121,K$123,K$125,K$127)) -> 3 | L12: =RANK(L11,(L$6,L$9,L$11,L$13,L$16,L$18,L$21,L$23,L$25,L$27,L$29,L$31,L$33,L$35,L$37,L$39,L$41,L$43,L$45,L$47,L$49,L$51,L$53,L$55,L$57,L$59,L$61,L$63,L$65,L$67,L$69,L$71,L$73,L$75,L$77,L$79,L$81,L$83,L$85,L$87,L$89,L$91,L$93,L$95,L$97,L$99,L$101,L$103,L$105,L$107,L$109,L$111,L$113,L$115,L$117,L$119,L$121,L$123,L$125,L$127)) -> 2 | M12: =RANK(M11,(M$6,M$9,M$11,M$13,M$16,M$18,M$21,M$23,M$25,M$27,M$29,M$31,M$33,M$35,M$37,M$39,M$41,M$43,M$45,M$47,M$49,M$51,M$53,M$55,M$57,M$59,M$61,M$63,M$65,M$67,M$69,M$71,M$73,M$75,M$77,M$79,M$81,M$83,M$85,M$87,M$89,M$91,M$93,M$95,M$97,M$99,M$101,M$103,M$105,M$107,M$109,M$111,M$113,M$115,M$117,M$119,M$121,M$123,M$125,M$127)) -> 3 | N12: =RANK(N11,(N$6,N$9,N$11,N$13,N$16,N$18,N$21,N$23,N$25,N$27,N$29,N$31,N$33,N$35,N$37,N$39,N$41,N$43,N$45,N$47,N$49,N$51,N$53,N$55,N$57,N$59,N$61,N$63,N$65,N$67,N$69,N$71,N$73,N$75,N$77,N$79,N$81,N$83,N$85,N$87,N$89,N$91,N$93,N$95,N$97,N$99,N$101,N$103,N$105,N$107,N$109,N$111,N$113,N$115,N$117,N$119,N$121,N$123,N$125,N$127)) -> 2 | P12: =RANK(P11,(P$6,P$9,P$11,P$13,P$16,P$18,P$21,P$23,P$25,P$27,P$29,P$31,P$33,P$35,P$37,P$39,P$41,P$43,P$45,P$47,P$49,P$51,P$53,P$55,P$57,P$59,P$61,P$63,P$65,P$67,P$69,P$71,P$73,P$75,P$77,P$79,P$81,P$83,P$85,P$87,P$89,P$91,P$93,P$95,P$97,P$99,P$101,P$103,P$105,P$107,P$109,P$111,P$113,P$115,P$117,P$119,P$121,P$123,P$125,P$127)) -> 2
A13: Hawthorne | B13: 1 | C13: 17.10 | D13: 16.80 | E13: 33.90 | F13: 16.90 | G13: 17.00 | H13: 16.90 | I13: 25.40 | J13: 16.70 | K13: 17.30 | L13: 17.50 | M13: 25.75 | N13: 85.05 | O13: 0.0 | P13: 85.05
A14: Caballeros | C14: 3 | D14: 3 | E14: 3 | F14: 2 | G14: 3 | H14: 3 | I14: 3 | J14: =RANK(J13,(J$6,J$9,J$11,J$13,J$16,J$18,J$21,J$23,J$25,J$27,J$29,J$31,J$33,J$35,J$37,J$39,J$41,J$43,J$45,J$47,J$49,J$51,J$53,J$55,J$57,J$59,J$61,J$63,J$65,J$67,J$69,J$71,J$73,J$75,J$77,J$79,J$81,J$83,J$85,J$87,J$89,J$91,J$93,J$95,J$97,J$99,J$101,J$103,J$105,J$107,J$109,J$111,J$113,J$115,J$117,J$119,J$121,J$123,J$125,J$127)) -> 2 | K14: =RANK(K13,(K$6,K$9,K$11,K$13,K$16,K$18,K$21,K$23,K$25,K$27,K$29,K$31,K$33,K$35,K$37,K$39,K$41,K$43,K$45,K$47,K$49,K$51,K$53,K$55,K$57,K$59,K$61,K$63,K$65,K$67,K$69,K$71,K$73,K$75,K$77,K$79,K$81,K$83,K$85,K$87,K$89,K$91,K$93,K$95,K$97,K$99,K$101,K$103,K$105,K$107,K$109,K$111,K$113,K$115,K$117,K$119,K$121,K$123,K$125,K$127)) -> 2 | L14: =RANK(L13,(L$6,L$9,L$11,L$13,L$16,L$18,L$21,L$23,L$25,L$27,L$29,L$31,L$33,L$35,L$37,L$39,L$41,L$43,L$45,L$47,L$49,L$51,L$53,L$55,L$57,L$59,L$61,L$63,L$65,L$67,L$69,L$71,L$73,L$75,L$77,L$79,L$81,L$83,L$85,L$87,L$89,L$91,L$93,L$95,L$97,L$99,L$101,L$103,L$105,L$107,L$109,L$111,L$113,L$115,L$117,L$119,L$121,L$123,L$125,L$127)) -> 3 | M14: =RANK(M13,(M$6,M$9,M$11,M$13,M$16,M$18,M$21,M$23,M$25,M$27,M$29,M$31,M$33,M$35,M$37,M$39,M$41,M$43,M$45,M$47,M$49,M$51,M$53,M$55,M$57,M$59,M$61,M$63,M$65,M$67,M$69,M$71,M$73,M$75,M$77,M$79,M$81,M$83,M$85,M$87,M$89,M$91,M$93,M$95,M$97,M$99,M$101,M$103,M$105,M$107,M$109,M$111,M$113,M$115,M$117,M$119,M$121,M$123,M$125,M$127)) -> 2 | N14: =RANK(N13,(N$6,N$9,N$11,N$13,N$16,N$18,N$21,N$23,N$25,N$27,N$29,N$31,N$33,N$35,N$37,N$39,N$41,N$43,N$45,N$47,N$49,N$51,N$53,N$55,N$57,N$59,N$61,N$63,N$65,N$67,N$69,N$71,N$73,N$75,N$77,N$79,N$81,N$83,N$85,N$87,N$89,N$91,N$93,N$95,N$97,N$99,N$101,N$103,N$105,N$107,N$109,N$111,N$113,N$115,N$117,N$119,N$121,N$123,N$125,N$127)) -> 3 | P14: =RANK(P13,(P$6,P$9,P$11,P$13,P$16,P$18,P$21,P$23,P$25,P$27,P$29,P$31,P$33,P$35,P$37,P$39,P$41,P$43,P$45,P$47,P$49,P$51,P$53,P$55,P$57,P$59,P$61,P$63,P$65,P$67,P$69,P$71,P$73,P$75,P$77,P$79,P$81,P$83,P$85,P$87,P$89,P$91,P$93,P$95,P$97,P$99,P$101,P$103,P$105,P$107,P$109,P$111,P$113,P$115,P$117,P$119,P$121,P$123,P$125,P$127)) -> 3
A15: DCI All Age Open Class
A16: White | B16: 1 | C16: 15.40 | D16: 15.60 | E16: 31.00 | F16: 15.80 | G16: 15.20 | H16: 15.30 | I16: 23.15 | J16: 15.80 | K16: 15.80 | L16: 16.00 | M16: 23.80 | N16: 77.95 | O16: 0.0 | P16: 77.95
A17: Sabers | C17: 1 | D17: 1 | E17: 1 | F17: 1 | G17: 1 | H17: 2 | I17: 1 | J17: 1 | K17: 1 | L17: 1 | M17: 1 | N17: 1 | P17: =RANK(P16,(P$6,P$9,P$11,P$13,P$16,P$18,P$21,P$23,P$25,P$27,P$29,P$31,P$33,P$35,P$37,P$39,P$41,P$43,P$45,P$47,P$49,P$51,P$53,P$55,P$57,P$59,P$61,P$63,P$65,P$67,P$69,P$71,P$73,P$75,P$77,P$79,P$81,P$83,P$85,P$87,P$89,P$91,P$93,P$95,P$97,P$99,P$101,P$103,P$105,P$107,P$109,P$111,P$113,P$115,P$117,P$119,P$121,P$123,P$125,P$127)) -> 4
A18: Fusion | B18: 2 | C18: 15.10 | D18: 15.20 | E18: 30.30 | F18: 15.50 | G18: 14.90 | H18: 15.50 | I18: 22.95 | J18: 14.90 | K18: 15.20 | L18: 15.40 | M18: 22.75 | N18: 76.00 | O18: 0.0 | P18: 76.00
A19: Core | C19: 2 | D19: 2 | E19: 2 | F19: 2 | G19: 2 | H19: 1 | I19: 2 | J19: 2 | K19: 2 | L19: 2 | M19: 2 | N19: 2 | P19: 2
A20: DCI All Age Class A
A21: Skyliners | B21: 1 | C21: 13.60 | D21: 13.20 | E21: 26.80 | F21: 13.50 | G21: 13.70 | H21: 13.40 | I21: 20.30 | J21: 13.10 | K21: 13.90 | L21: 12.80 | M21: 19.90 | N21: 67.00 | O21: 0.0 | P21: 67.00
C22: 1 | D22: 1 | E22: 1 | F22: 1 | G22: 1 | H22: 1 | I22: 1 | J22: 1 | K22: 1 | L22: 1 | M22: 1 | N22: 1 | P22: 1