A1: 7/13/2024 DeKalb, Illinois
C2: General Effect | F2: Visual | J2: Music
C3: 1 | D3: 2 | F3: Proficiency | G3: Analysis | H3: Color Guard | J3: Brass | K3: Analysis | L3: Percussion | N3: Sub | P3: Total
C4: K. Baker | D4: A. Cook | E4: Total | F4: T. Wemhoff | G4: C. Church | H4: T. Hundall | I4: Total ÷2 | J4: D. Argl | K4: M. Howard | L4: B. Williams | M4: Total ÷2 | N4: Total | O4: Pen | P4: Score
A5: DCI World Class | C5: 20 | D5: 20 | E5: 40 | F5: 20 | G5: 20 | H5: 20 | I5: 30 | J5: 20 | K5: 20 | L5: 20 | M5: 30 | N5: 100 | P5: 100
A6: Bluecoats | B6: 5 | C6: 17.30 | D6: 17.20 | E6: 34.50 | F6: 17.40 | G6: 17.20 | H6: 17.70 | I6: 26.15 | J6: 17.80 | K6: 17.50 | L6: 17.50 | M6: 26.40 | N6: 87.05 | O6: 0.0 | P6: 87.05
C7: =RANK(C6,(C$6,C$8,C$10,C$12,C$14,C$16,C$19,C$21,C$23,C$25,C$27,C$29,C$31,C$33,C$35,C$37,C$39,C$41,C$43,C$45,C$47,C$49,C$51,C$53,C$55,C$57,C$59,C$61,C$63,C$65,C$67,C$69,C$71,C$73,C$75,C$77,C$79,C$81,C$83,C$85,C$87,C$89,C$91,C$93,C$95,C$97,C$99,C$101,C$103,C$105,C$107,C$109,C$111,C$113,C$115,C$117,C$119,C$121,C$123,C$125)) -> 1 | D7: =RANK(D6,(D$6,D$8,D$10,D$12,D$14,D$16,D$19,D$21,D$23,D$25,D$27,D$29,D$31,D$33,D$35,D$37,D$39,D$41,D$43,D$45,D$47,D$49,D$51,D$53,D$55,D$57,D$59,D$61,D$63,D$65,D$67,D$69,D$71,D$73,D$75,D$77,D$79,D$81,D$83,D$85,D$87,D$89,D$91,D$93,D$95,D$97,D$99,D$101,D$103,D$105,D$107,D$109,D$111,D$113,D$115,D$117,D$119,D$121,D$123,D$125)) -> 1 | E7: =RANK(E6,(E$6,E$8,E$10,E$12,E$14,E$16,E$19,E$21,E$23,E$25,E$27,E$29,E$31,E$33,E$35,E$37,E$39,E$41,E$43,E$45,E$47,E$49,E$51,E$53,E$55,E$57,E$59,E$61,E$63,E$65,E$67,E$69,E$71,E$73,E$75,E$77,E$79,E$81,E$83,E$85,E$87,E$89,E$91,E$93,E$95,E$97,E$99,E$101,E$103,E$105,E$107,E$109,E$111,E$113,E$115,E$117,E$119,E$121,E$123,E$125)) -> 1 | F7: =RANK(F6,(F$6,F$8,F$10,F$12,F$14,F$16,F$19,F$21,F$23,F$25,F$27,F$29,F$31,F$33,F$35,F$37,F$39,F$41,F$43,F$45,F$47,F$49,F$51,F$53,F$55,F$57,F$59,F$61,F$63,F$65,F$67,F$69,F$71,F$73,F$75,F$77,F$79,F$81,F$83,F$85,F$87,F$89,F$91,F$93,F$95,F$97,F$99,F$101,F$103,F$105,F$107,F$109,F$111,F$113,F$115,F$117,F$119,F$121,F$123,F$125)) -> 1 | G7: =RANK(G6,(G$6,G$8,G$10,G$12,G$14,G$16,G$19,G$21,G$23,G$25,G$27,G$29,G$31,G$33,G$35,G$37,G$39,G$41,G$43,G$45,G$47,G$49,G$51,G$53,G$55,G$57,G$59,G$61,G$63,G$65,G$67,G$69,G$71,G$73,G$75,G$77,G$79,G$81,G$83,G$85,G$87,G$89,G$91,G$93,G$95,G$97,G$99,G$101,G$103,G$105,G$107,G$109,G$111,G$113,G$115,G$117,G$119,G$121,G$123,G$125)) -> 1 | H7: =RANK(H6,(H$6,H$8,H$10,H$12,H$14,H$16,H$19,H$21,H$23,H$25,H$27,H$29,H$31,H$33,H$35,H$37,H$39,H$41,H$43,H$45,H$47,H$49,H$51,H$53,H$55,H$57,H$59,H$61,H$63,H$65,H$67,H$69,H$71,H$73,H$75,H$77,H$79,H$81,H$83,H$85,H$87,H$89,H$91,H$93,H$95,H$97,H$99,H$101,H$103,H$105,H$107,H$109,H$111,H$113,H$115,H$117,H$119,H$121,H$123,H$125)) -> 1 | I7: =RANK(I6,(I$6,I$8,I$10,I$12,I$14,I$16,I$19,I$21,I$23,I$25,I$27,I$29,I$31,I$33,I$35,I$37,I$39,I$41,I$43,I$45,I$47,I$49,I$51,I$53,I$55,I$57,I$59,I$61,I$63,I$65,I$67,I$69,I$71,I$73,I$75,I$77,I$79,I$81,I$83,I$85,I$87,I$89,I$91,I$93,I$95,I$97,I$99,I$101,I$103,I$105,I$107,I$109,I$111,I$113,I$115,I$117,I$119,I$121,I$123,I$125)) -> 1 | J7: =RANK(J6,(J$6,J$8,J$10,J$12,J$14,J$16,J$19,J$21,J$23,J$25,J$27,J$29,J$31,J$33,J$35,J$37,J$39,J$41,J$43,J$45,J$47,J$49,J$51,J$53,J$55,J$57,J$59,J$61,J$63,J$65,J$67,J$69,J$71,J$73,J$75,J$77,J$79,J$81,J$83,J$85,J$87,J$89,J$91,J$93,J$95,J$97,J$99,J$101,J$103,J$105,J$107,J$109,J$111,J$113,J$115,J$117,J$119,J$121,J$123,J$125)) -> 1 | K7: =RANK(K6,(K$6,K$8,K$10,K$12,K$14,K$16,K$19,K$21,K$23,K$25,K$27,K$29,K$31,K$33,K$35,K$37,K$39,K$41,K$43,K$45,K$47,K$49,K$51,K$53,K$55,K$57,K$59,K$61,K$63,K$65,K$67,K$69,K$71,K$73,K$75,K$77,K$79,K$81,K$83,K$85,K$87,K$89,K$91,K$93,K$95,K$97,K$99,K$101,K$103,K$105,K$107,K$109,K$111,K$113,K$115,K$117,K$119,K$121,K$123,K$125)) -> 1 | L7: =RANK(L6,(L$6,L$8,L$10,L$12,L$14,L$16,L$19,L$21,L$23,L$25,L$27,L$29,L$31,L$33,L$35,L$37,L$39,L$41,L$43,L$45,L$47,L$49,L$51,L$53,L$55,L$57,L$59,L$61,L$63,L$65,L$67,L$69,L$71,L$73,L$75,L$77,L$79,L$81,L$83,L$85,L$87,L$89,L$91,L$93,L$95,L$97,L$99,L$101,L$103,L$105,L$107,L$109,L$111,L$113,L$115,L$117,L$119,L$121,L$123,L$125)) -> 1 | M7: =RANK(M6,(M$6,M$8,M$10,M$12,M$14,M$16,M$19,M$21,M$23,M$25,M$27,M$29,M$31,M$33,M$35,M$37,M$39,M$41,M$43,M$45,M$47,M$49,M$51,M$53,M$55,M$57,M$59,M$61,M$63,M$65,M$67,M$69,M$71,M$73,M$75,M$77,M$79,M$81,M$83,M$85,M$87,M$89,M$91,M$93,M$95,M$97,M$99,M$101,M$103,M$105,M$107,M$109,M$111,M$113,M$115,M$117,M$119,M$121,M$123,M$125)) -> 1 | N7: =RANK(N6,(N$6,N$8,N$10,N$12,N$14,N$16,N$19,N$21,N$23,N$25,N$27,N$29,N$31,N$33,N$35,N$37,N$39,N$41,N$43,N$45,N$47,N$49,N$51,N$53,N$55,N$57,N$59,N$61,N$63,N$65,N$67,N$69,N$71,N$73,N$75,N$77,N$79,N$81,N$83,N$85,N$87,N$89,N$91,N$93,N$95,N$97,N$99,N$101,N$103,N$105,N$107,N$109,N$111,N$113,N$115,N$117,N$119,N$121,N$123,N$125)) -> 1 | P7: =RANK(P6,(P$6,P$8,P$10,P$12,P$14,P$16,P$19,P$21,P$23,P$25,P$27,P$29,P$31,P$33,P$35,P$37,P$39,P$41,P$43,P$45,P$47,P$49,P$51,P$53,P$55,P$57,P$59,P$61,P$63,P$65,P$67,P$69,P$71,P$73,P$75,P$77,P$79,P$81,P$83,P$85,P$87,P$89,P$91,P$93,P$95,P$97,P$99,P$101,P$103,P$105,P$107,P$109,P$111,P$113,P$115,P$117,P$119,P$121,P$123,P$125)) -> 1
A8: Phantom | B8: 6 | C8: 16.80 | D8: 17.00 | E8: 33.80 | F8: 16.90 | G8: 16.90 | H8: 16.80 | I8: 25.30 | J8: 17.30 | K8: 16.80 | L8: 17.20 | M8: 25.65 | N8: 84.75 | O8: 0.0 | P8: 84.75
A9: Regiment | C9: =RANK(C8,(C$6,C$8,C$10,C$12,C$14,C$16,C$19,C$21,C$23,C$25,C$27,C$29,C$31,C$33,C$35,C$37,C$39,C$41,C$43,C$45,C$47,C$49,C$51,C$53,C$55,C$57,C$59,C$61,C$63,C$65,C$67,C$69,C$71,C$73,C$75,C$77,C$79,C$81,C$83,C$85,C$87,C$89,C$91,C$93,C$95,C$97,C$99,C$101,C$103,C$105,C$107,C$109,C$111,C$113,C$115,C$117,C$119,C$121,C$123,C$125)) -> 2 | D9: =RANK(D8,(D$6,D$8,D$10,D$12,D$14,D$16,D$19,D$21,D$23,D$25,D$27,D$29,D$31,D$33,D$35,D$37,D$39,D$41,D$43,D$45,D$47,D$49,D$51,D$53,D$55,D$57,D$59,D$61,D$63,D$65,D$67,D$69,D$71,D$73,D$75,D$77,D$79,D$81,D$83,D$85,D$87,D$89,D$91,D$93,D$95,D$97,D$99,D$101,D$103,D$105,D$107,D$109,D$111,D$113,D$115,D$117,D$119,D$121,D$123,D$125)) -> 2 | E9: =RANK(E8,(E$6,E$8,E$10,E$12,E$14,E$16,E$19,E$21,E$23,E$25,E$27,E$29,E$31,E$33,E$35,E$37,E$39,E$41,E$43,E$45,E$47,E$49,E$51,E$53,E$55,E$57,E$59,E$61,E$63,E$65,E$67,E$69,E$71,E$73,E$75,E$77,E$79,E$81,E$83,E$85,E$87,E$89,E$91,E$93,E$95,E$97,E$99,E$101,E$103,E$105,E$107,E$109,E$111,E$113,E$115,E$117,E$119,E$121,E$123,E$125)) -> 2 | F9: =RANK(F8,(F$6,F$8,F$10,F$12,F$14,F$16,F$19,F$21,F$23,F$25,F$27,F$29,F$31,F$33,F$35,F$37,F$39,F$41,F$43,F$45,F$47,F$49,F$51,F$53,F$55,F$57,F$59,F$61,F$63,F$65,F$67,F$69,F$71,F$73,F$75,F$77,F$79,F$81,F$83,F$85,F$87,F$89,F$91,F$93,F$95,F$97,F$99,F$101,F$103,F$105,F$107,F$109,F$111,F$113,F$115,F$117,F$119,F$121,F$123,F$125)) -> 2 | G9: =RANK(G8,(G$6,G$8,G$10,G$12,G$14,G$16,G$19,G$21,G$23,G$25,G$27,G$29,G$31,G$33,G$35,G$37,G$39,G$41,G$43,G$45,G$47,G$49,G$51,G$53,G$55,G$57,G$59,G$61,G$63,G$65,G$67,G$69,G$71,G$73,G$75,G$77,G$79,G$81,G$83,G$85,G$87,G$89,G$91,G$93,G$95,G$97,G$99,G$101,G$103,G$105,G$107,G$109,G$111,G$113,G$115,G$117,G$119,G$121,G$123,G$125)) -> 2 | H9: =RANK(H8,(H$6,H$8,H$10,H$12,H$14,H$16,H$19,H$21,H$23,H$25,H$27,H$29,H$31,H$33,H$35,H$37,H$39,H$41,H$43,H$45,H$47,H$49,H$51,H$53,H$55,H$57,H$59,H$61,H$63,H$65,H$67,H$69,H$71,H$73,H$75,H$77,H$79,H$81,H$83,H$85,H$87,H$89,H$91,H$93,H$95,H$97,H$99,H$101,H$103,H$105,H$107,H$109,H$111,H$113,H$115,H$117,H$119,H$121,H$123,H$125)) -> 2 | I9: =RANK(I8,(I$6,I$8,I$10,I$12,I$14,I$16,I$19,I$21,I$23,I$25,I$27,I$29,I$31,I$33,I$35,I$37,I$39,I$41,I$43,I$45,I$47,I$49,I$51,I$53,I$55,I$57,I$59,I$61,I$63,I$65,I$67,I$69,I$71,I$73,I$75,I$77,I$79,I$81,I$83,I$85,I$87,I$89,I$91,I$93,I$95,I$97,I$99,I$101,I$103,I$105,I$107,I$109,I$111,I$113,I$115,I$117,I$119,I$121,I$123,I$125)) -> 2 | J9: =RANK(J8,(J$6,J$8,J$10,J$12,J$14,J$16,J$19,J$21,J$23,J$25,J$27,J$29,J$31,J$33,J$35,J$37,J$39,J$41,J$43,J$45,J$47,J$49,J$51,J$53,J$55,J$57,J$59,J$61,J$63,J$65,J$67,J$69,J$71,J$73,J$75,J$77,J$79,J$81,J$83,J$85,J$87,J$89,J$91,J$93,J$95,J$97,J$99,J$101,J$103,J$105,J$107,J$109,J$111,J$113,J$115,J$117,J$119,J$121,J$123,J$125)) -> 2 | K9: =RANK(K8,(K$6,K$8,K$10,K$12,K$14,K$16,K$19,K$21,K$23,K$25,K$27,K$29,K$31,K$33,K$35,K$37,K$39,K$41,K$43,K$45,K$47,K$49,K$51,K$53,K$55,K$57,K$59,K$61,K$63,K$65,K$67,K$69,K$71,K$73,K$75,K$77,K$79,K$81,K$83,K$85,K$87,K$89,K$91,K$93,K$95,K$97,K$99,K$101,K$103,K$105,K$107,K$109,K$111,K$113,K$115,K$117,K$119,K$121,K$123,K$125)) -> 2 | L9: =RANK(L8,(L$6,L$8,L$10,L$12,L$14,L$16,L$19,L$21,L$23,L$25,L$27,L$29,L$31,L$33,L$35,L$37,L$39,L$41,L$43,L$45,L$47,L$49,L$51,L$53,L$55,L$57,L$59,L$61,L$63,L$65,L$67,L$69,L$71,L$73,L$75,L$77,L$79,L$81,L$83,L$85,L$87,L$89,L$91,L$93,L$95,L$97,L$99,L$101,L$103,L$105,L$107,L$109,L$111,L$113,L$115,L$117,L$119,L$121,L$123,L$125)) -> 2 | M9: =RANK(M8,(M$6,M$8,M$10,M$12,M$14,M$16,M$19,M$21,M$23,M$25,M$27,M$29,M$31,M$33,M$35,M$37,M$39,M$41,M$43,M$45,M$47,M$49,M$51,M$53,M$55,M$57,M$59,M$61,M$63,M$65,M$67,M$69,M$71,M$73,M$75,M$77,M$79,M$81,M$83,M$85,M$87,M$89,M$91,M$93,M$95,M$97,M$99,M$101,M$103,M$105,M$107,M$109,M$111,M$113,M$115,M$117,M$119,M$121,M$123,M$125)) -> 2 | N9: =RANK(N8,(N$6,N$8,N$10,N$12,N$14,N$16,N$19,N$21,N$23,N$25,N$27,N$29,N$31,N$33,N$35,N$37,N$39,N$41,N$43,N$45,N$47,N$49,N$51,N$53,N$55,N$57,N$59,N$61,N$63,N$65,N$67,N$69,N$71,N$73,N$75,N$77,N$79,N$81,N$83,N$85,N$87,N$89,N$91,N$93,N$95,N$97,N$99,N$101,N$103,N$105,N$107,N$109,N$111,N$113,N$115,N$117,N$119,N$121,N$123,N$125)) -> 2 | P9: =RANK(P8,(P$6,P$8,P$10,P$12,P$14,P$16,P$19,P$21,P$23,P$25,P$27,P$29,P$31,P$33,P$35,P$37,P$39,P$41,P$43,P$45,P$47,P$49,P$51,P$53,P$55,P$57,P$59,P$61,P$63,P$65,P$67,P$69,P$71,P$73,P$75,P$77,P$79,P$81,P$83,P$85,P$87,P$89,P$91,P$93,P$95,P$97,P$99,P$101,P$103,P$105,P$107,P$109,P$111,P$113,P$115,P$117,P$119,P$121,P$123,P$125)) -> 2
A10: Cavaliers | B10: 3 | C10: 16.00 | D10: 15.70 | E10: 31.70 | F10: 15.90 | G10: 15.80 | H10: 16.20 | I10: 23.95 | J10: 16.00 | K10: 15.90 | L10: 16.00 | M10: 23.95 | N10: 79.60 | O10: 0.0 | P10: 79.60
C11: =RANK(C10,(C$6,C$8,C$10,C$12,C$14,C$16,C$19,C$21,C$23,C$25,C$27,C$29,C$31,C$33,C$35,C$37,C$39,C$41,C$43,C$45,C$47,C$49,C$51,C$53,C$55,C$57,C$59,C$61,C$63,C$65,C$67,C$69,C$71,C$73,C$75,C$77,C$79,C$81,C$83,C$85,C$87,C$89,C$91,C$93,C$95,C$97,C$99,C$101,C$103,C$105,C$107,C$109,C$111,C$113,C$115,C$117,C$119,C$121,C$123,C$125)) -> 3 | D11: =RANK(D10,(D$6,D$8,D$10,D$12,D$14,D$16,D$19,D$21,D$23,D$25,D$27,D$29,D$31,D$33,D$35,D$37,D$39,D$41,D$43,D$45,D$47,D$49,D$51,D$53,D$55,D$57,D$59,D$61,D$63,D$65,D$67,D$69,D$71,D$73,D$75,D$77,D$79,D$81,D$83,D$85,D$87,D$89,D$91,D$93,D$95,D$97,D$99,D$101,D$103,D$105,D$107,D$109,D$111,D$113,D$115,D$117,D$119,D$121,D$123,D$125)) -> 3 | E11: =RANK(E10,(E$6,E$8,E$10,E$12,E$14,E$16,E$19,E$21,E$23,E$25,E$27,E$29,E$31,E$33,E$35,E$37,E$39,E$41,E$43,E$45,E$47,E$49,E$51,E$53,E$55,E$57,E$59,E$61,E$63,E$65,E$67,E$69,E$71,E$73,E$75,E$77,E$79,E$81,E$83,E$85,E$87,E$89,E$91,E$93,E$95,E$97,E$99,E$101,E$103,E$105,E$107,E$109,E$111,E$113,E$115,E$117,E$119,E$121,E$123,E$125)) -> 3 | F11: =RANK(F10,(F$6,F$8,F$10,F$12,F$14,F$16,F$19,F$21,F$23,F$25,F$27,F$29,F$31,F$33,F$35,F$37,F$39,F$41,F$43,F$45,F$47,F$49,F$51,F$53,F$55,F$57,F$59,F$61,F$63,F$65,F$67,F$69,F$71,F$73,F$75,F$77,F$79,F$81,F$83,F$85,F$87,F$89,F$91,F$93,F$95,F$97,F$99,F$101,F$103,F$105,F$107,F$109,F$111,F$113,F$115,F$117,F$119,F$121,F$123,F$125)) -> 5 | G11: =RANK(G10,(G$6,G$8,G$10,G$12,G$14,G$16,G$19,G$21,G$23,G$25,G$27,G$29,G$31,G$33,G$35,G$37,G$39,G$41,G$43,G$45,G$47,G$49,G$51,G$53,G$55,G$57,G$59,G$61,G$63,G$65,G$67,G$69,G$71,G$73,G$75,G$77,G$79,G$81,G$83,G$85,G$87,G$89,G$91,G$93,G$95,G$97,G$99,G$101,G$103,G$105,G$107,G$109,G$111,G$113,G$115,G$117,G$119,G$121,G$123,G$125)) -> 4 | H11: =RANK(H10,(H$6,H$8,H$10,H$12,H$14,H$16,H$19,H$21,H$23,H$25,H$27,H$29,H$31,H$33,H$35,H$37,H$39,H$41,H$43,H$45,H$47,H$49,H$51,H$53,H$55,H$57,H$59,H$61,H$63,H$65,H$67,H$69,H$71,H$73,H$75,H$77,H$79,H$81,H$83,H$85,H$87,H$89,H$91,H$93,H$95,H$97,H$99,H$101,H$103,H$105,H$107,H$109,H$111,H$113,H$115,H$117,H$119,H$121,H$123,H$125)) -> 4 | I11: =RANK(I10,(I$6,I$8,I$10,I$12,I$14,I$16,I$19,I$21,I$23,I$25,I$27,I$29,I$31,I$33,I$35,I$37,I$39,I$41,I$43,I$45,I$47,I$49,I$51,I$53,I$55,I$57,I$59,I$61,I$63,I$65,I$67,I$69,I$71,I$73,I$75,I$77,I$79,I$81,I$83,I$85,I$87,I$89,I$91,I$93,I$95,I$97,I$99,I$101,I$103,I$105,I$107,I$109,I$111,I$113,I$115,I$117,I$119,I$121,I$123,I$125)) -> 4 | J11: =RANK(J10,(J$6,J$8,J$10,J$12,J$14,J$16,J$19,J$21,J$23,J$25,J$27,J$29,J$31,J$33,J$35,J$37,J$39,J$41,J$43,J$45,J$47,J$49,J$51,J$53,J$55,J$57,J$59,J$61,J$63,J$65,J$67,J$69,J$71,J$73,J$75,J$77,J$79,J$81,J$83,J$85,J$87,J$89,J$91,J$93,J$95,J$97,J$99,J$101,J$103,J$105,J$107,J$109,J$111,J$113,J$115,J$117,J$119,J$121,J$123,J$125)) -> 5 | K11: =RANK(K10,(K$6,K$8,K$10,K$12,K$14,K$16,K$19,K$21,K$23,K$25,K$27,K$29,K$31,K$33,K$35,K$37,K$39,K$41,K$43,K$45,K$47,K$49,K$51,K$53,K$55,K$57,K$59,K$61,K$63,K$65,K$67,K$69,K$71,K$73,K$75,K$77,K$79,K$81,K$83,K$85,K$87,K$89,K$91,K$93,K$95,K$97,K$99,K$101,K$103,K$105,K$107,K$109,K$111,K$113,K$115,K$117,K$119,K$121,K$123,K$125)) -> 4 | L11: =RANK(L10,(L$6,L$8,L$10,L$12,L$14,L$16,L$19,L$21,L$23,L$25,L$27,L$29,L$31,L$33,L$35,L$37,L$39,L$41,L$43,L$45,L$47,L$49,L$51,L$53,L$55,L$57,L$59,L$61,L$63,L$65,L$67,L$69,L$71,L$73,L$75,L$77,L$79,L$81,L$83,L$85,L$87,L$89,L$91,L$93,L$95,L$97,L$99,L$101,L$103,L$105,L$107,L$109,L$111,L$113,L$115,L$117,L$119,L$121,L$123,L$125)) -> 5 | M11: =RANK(M10,(M$6,M$8,M$10,M$12,M$14,M$16,M$19,M$21,M$23,M$25,M$27,M$29,M$31,M$33,M$35,M$37,M$39,M$41,M$43,M$45,M$47,M$49,M$51,M$53,M$55,M$57,M$59,M$61,M$63,M$65,M$67,M$69,M$71,M$73,M$75,M$77,M$79,M$81,M$83,M$85,M$87,M$89,M$91,M$93,M$95,M$97,M$99,M$101,M$103,M$105,M$107,M$109,M$111,M$113,M$115,M$117,M$119,M$121,M$123,M$125)) -> 5 | N11: =RANK(N10,(N$6,N$8,N$10,N$12,N$14,N$16,N$19,N$21,N$23,N$25,N$27,N$29,N$31,N$33,N$35,N$37,N$39,N$41,N$43,N$45,N$47,N$49,N$51,N$53,N$55,N$57,N$59,N$61,N$63,N$65,N$67,N$69,N$71,N$73,N$75,N$77,N$79,N$81,N$83,N$85,N$87,N$89,N$91,N$93,N$95,N$97,N$99,N$101,N$103,N$105,N$107,N$109,N$111,N$113,N$115,N$117,N$119,N$121,N$123,N$125)) -> 3 | P11: =RANK(P10,(P$6,P$8,P$10,P$12,P$14,P$16,P$19,P$21,P$23,P$25,P$27,P$29,P$31,P$33,P$35,P$37,P$39,P$41,P$43,P$45,P$47,P$49,P$51,P$53,P$55,P$57,P$59,P$61,P$63,P$65,P$67,P$69,P$71,P$73,P$75,P$77,P$79,P$81,P$83,P$85,P$87,P$89,P$91,P$93,P$95,P$97,P$99,P$101,P$103,P$105,P$107,P$109,P$111,P$113,P$115,P$117,P$119,P$121,P$123,P$125)) -> 3
A12: Blue | B12: 2 | C12: 15.20 | D12: 15.30 | E12: 30.50 | F12: 16.10 | G12: 15.50 | H12: 16.30 | I12: 23.95 | J12: 16.50 | K12: 15.70 | L12: 16.70 | M12: 24.45 | N12: 78.90 | O12: 0.0 | P12: 78.90
A13: Stars | C13: =RANK(C12,(C$6,C$8,C$10,C$12,C$14,C$16,C$19,C$21,C$23,C$25,C$27,C$29,C$31,C$33,C$35,C$37,C$39,C$41,C$43,C$45,C$47,C$49,C$51,C$53,C$55,C$57,C$59,C$61,C$63,C$65,C$67,C$69,C$71,C$73,C$75,C$77,C$79,C$81,C$83,C$85,C$87,C$89,C$91,C$93,C$95,C$97,C$99,C$101,C$103,C$105,C$107,C$109,C$111,C$113,C$115,C$117,C$119,C$121,C$123,C$125)) -> 4 | D13: =RANK(D12,(D$6,D$8,D$10,D$12,D$14,D$16,D$19,D$21,D$23,D$25,D$27,D$29,D$31,D$33,D$35,D$37,D$39,D$41,D$43,D$45,D$47,D$49,D$51,D$53,D$55,D$57,D$59,D$61,D$63,D$65,D$67,D$69,D$71,D$73,D$75,D$77,D$79,D$81,D$83,D$85,D$87,D$89,D$91,D$93,D$95,D$97,D$99,D$101,D$103,D$105,D$107,D$109,D$111,D$113,D$115,D$117,D$119,D$121,D$123,D$125)) -> 5 | E13: =RANK(E12,(E$6,E$8,E$10,E$12,E$14,E$16,E$19,E$21,E$23,E$25,E$27,E$29,E$31,E$33,E$35,E$37,E$39,E$41,E$43,E$45,E$47,E$49,E$51,E$53,E$55,E$57,E$59,E$61,E$63,E$65,E$67,E$69,E$71,E$73,E$75,E$77,E$79,E$81,E$83,E$85,E$87,E$89,E$91,E$93,E$95,E$97,E$99,E$101,E$103,E$105,E$107,E$109,E$111,E$113,E$115,E$117,E$119,E$121,E$123,E$125)) -> 5 | F13: =RANK(F12,(F$6,F$8,F$10,F$12,F$14,F$16,F$19,F$21,F$23,F$25,F$27,F$29,F$31,F$33,F$35,F$37,F$39,F$41,F$43,F$45,F$47,F$49,F$51,F$53,F$55,F$57,F$59,F$61,F$63,F$65,F$67,F$69,F$71,F$73,F$75,F$77,F$79,F$81,F$83,F$85,F$87,F$89,F$91,F$93,F$95,F$97,F$99,F$101,F$103,F$105,F$107,F$109,F$111,F$113,F$115,F$117,F$119,F$121,F$123,F$125)) -> 3 | G13: =RANK(G12,(G$6,G$8,G$10,G$12,G$14,G$16,G$19,G$21,G$23,G$25,G$27,G$29,G$31,G$33,G$35,G$37,G$39,G$41,G$43,G$45,G$47,G$49,G$51,G$53,G$55,G$57,G$59,G$61,G$63,G$65,G$67,G$69,G$71,G$73,G$75,G$77,G$79,G$81,G$83,G$85,G$87,G$89,G$91,G$93,G$95,G$97,G$99,G$101,G$103,G$105,G$107,G$109,G$111,G$113,G$115,G$117,G$119,G$121,G$123,G$125)) -> 5 | H13: =RANK(H12,(H$6,H$8,H$10,H$12,H$14,H$16,H$19,H$21,H$23,H$25,H$27,H$29,H$31,H$33,H$35,H$37,H$39,H$41,H$43,H$45,H$47,H$49,H$51,H$53,H$55,H$57,H$59,H$61,H$63,H$65,H$67,H$69,H$71,H$73,H$75,H$77,H$79,H$81,H$83,H$85,H$87,H$89,H$91,H$93,H$95,H$97,H$99,H$101,H$103,H$105,H$107,H$109,H$111,H$113,H$115,H$117,H$119,H$121,H$123,H$125)) -> 3 | I13: =RANK(I12,(I$6,I$8,I$10,I$12,I$14,I$16,I$19,I$21,I$23,I$25,I$27,I$29,I$31,I$33,I$35,I$37,I$39,I$41,I$43,I$45,I$47,I$49,I$51,I$53,I$55,I$57,I$59,I$61,I$63,I$65,I$67,I$69,I$71,I$73,I$75,I$77,I$79,I$81,I$83,I$85,I$87,I$89,I$91,I$93,I$95,I$97,I$99,I$101,I$103,I$105,I$107,I$109,I$111,I$113,I$115,I$117,I$119,I$121,I$123,I$125)) -> 4 | J13: =RANK(J12,(J$6,J$8,J$10,J$12,J$14,J$16,J$19,J$21,J$23,J$25,J$27,J$29,J$31,J$33,J$35,J$37,J$39,J$41,J$43,J$45,J$47,J$49,J$51,J$53,J$55,J$57,J$59,J$61,J$63,J$65,J$67,J$69,J$71,J$73,J$75,J$77,J$79,J$81,J$83,J$85,J$87,J$89,J$91,J$93,J$95,J$97,J$99,J$101,J$103,J$105,J$107,J$109,J$111,J$113,J$115,J$117,J$119,J$121,J$123,J$125)) -> 3 | K13: =RANK(K12,(K$6,K$8,K$10,K$12,K$14,K$16,K$19,K$21,K$23,K$25,K$27,K$29,K$31,K$33,K$35,K$37,K$39,K$41,K$43,K$45,K$47,K$49,K$51,K$53,K$55,K$57,K$59,K$61,K$63,K$65,K$67,K$69,K$71,K$73,K$75,K$77,K$79,K$81,K$83,K$85,K$87,K$89,K$91,K$93,K$95,K$97,K$99,K$101,K$103,K$105,K$107,K$109,K$111,K$113,K$115,K$117,K$119,K$121,K$123,K$125)) -> 5 | L13: =RANK(L12,(L$6,L$8,L$10,L$12,L$14,L$16,L$19,L$21,L$23,L$25,L$27,L$29,L$31,L$33,L$35,L$37,L$39,L$41,L$43,L$45,L$47,L$49,L$51,L$53,L$55,L$57,L$59,L$61,L$63,L$65,L$67,L$69,L$71,L$73,L$75,L$77,L$79,L$81,L$83,L$85,L$87,L$89,L$91,L$93,L$95,L$97,L$99,L$101,L$103,L$105,L$107,L$109,L$111,L$113,L$115,L$117,L$119,L$121,L$123,L$125)) -> 3 | M13: =RANK(M12,(M$6,M$8,M$10,M$12,M$14,M$16,M$19,M$21,M$23,M$25,M$27,M$29,M$31,M$33,M$35,M$37,M$39,M$41,M$43,M$45,M$47,M$49,M$51,M$53,M$55,M$57,M$59,M$61,M$63,M$65,M$67,M$69,M$71,M$73,M$75,M$77,M$79,M$81,M$83,M$85,M$87,M$89,M$91,M$93,M$95,M$97,M$99,M$101,M$103,M$105,M$107,M$109,M$111,M$113,M$115,M$117,M$119,M$121,M$123,M$125)) -> 3 | N13: =RANK(N12,(N$6,N$8,N$10,N$12,N$14,N$16,N$19,N$21,N$23,N$25,N$27,N$29,N$31,N$33,N$35,N$37,N$39,N$41,N$43,N$45,N$47,N$49,N$51,N$53,N$55,N$57,N$59,N$61,N$63,N$65,N$67,N$69,N$71,N$73,N$75,N$77,N$79,N$81,N$83,N$85,N$87,N$89,N$91,N$93,N$95,N$97,N$99,N$101,N$103,N$105,N$107,N$109,N$111,N$113,N$115,N$117,N$119,N$121,N$123,N$125)) -> 4 | P13: =RANK(P12,(P$6,P$8,P$10,P$12,P$14,P$16,P$19,P$21,P$23,P$25,P$27,P$29,P$31,P$33,P$35,P$37,P$39,P$41,P$43,P$45,P$47,P$49,P$51,P$53,P$55,P$57,P$59,P$61,P$63,P$65,P$67,P$69,P$71,P$73,P$75,P$77,P$79,P$81,P$83,P$85,P$87,P$89,P$91,P$93,P$95,P$97,P$99,P$101,P$103,P$105,P$107,P$109,P$111,P$113,P$115,P$117,P$119,P$121,P$123,P$125)) -> 4
A14: Colts | B14: 4 | C14: 15.10 | D14: 15.50 | E14: 30.60 | F14: 16.00 | G14: 15.90 | H14: 16.10 | I14: 24.00 | J14: 16.20 | K14: 16.00 | L14: 16.30 | M14: 24.25 | N14: 78.85 | O14: 0.0 | P14: 78.85
C15: =RANK(C14,(C$6,C$8,C$10,C$12,C$14,C$16,C$19,C$21,C$23,C$25,C$27,C$29,C$31,C$33,C$35,C$37,C$39,C$41,C$43,C$45,C$47,C$49,C$51,C$53,C$55,C$57,C$59,C$61,C$63,C$65,C$67,C$69,C$71,C$73,C$75,C$77,C$79,C$81,C$83,C$85,C$87,C$89,C$91,C$93,C$95,C$97,C$99,C$101,C$103,C$105,C$107,C$109,C$111,C$113,C$115,C$117,C$119,C$121,C$123,C$125)) -> 5 | D15: =RANK(D14,(D$6,D$8,D$10,D$12,D$14,D$16,D$19,D$21,D$23,D$25,D$27,D$29,D$31,D$33,D$35,D$37,D$39,D$41,D$43,D$45,D$47,D$49,D$51,D$53,D$55,D$57,D$59,D$61,D$63,D$65,D$67,D$69,D$71,D$73,D$75,D$77,D$79,D$81,D$83,D$85,D$87,D$89,D$91,D$93,D$95,D$97,D$99,D$101,D$103,D$105,D$107,D$109,D$111,D$113,D$115,D$117,D$119,D$121,D$123,D$125)) -> 4 | E15: =RANK(E14,(E$6,E$8,E$10,E$12,E$14,E$16,E$19,E$21,E$23,E$25,E$27,E$29,E$31,E$33,E$35,E$37,E$39,E$41,E$43,E$45,E$47,E$49,E$51,E$53,E$55,E$57,E$59,E$61,E$63,E$65,E$67,E$69,E$71,E$73,E$75,E$77,E$79,E$81,E$83,E$85,E$87,E$89,E$91,E$93,E$95,E$97,E$99,E$101,E$103,E$105,E$107,E$109,E$111,E$113,E$115,E$117,E$119,E$121,E$123,E$125)) -> 4 | F15: =RANK(F14,(F$6,F$8,F$10,F$12,F$14,F$16,F$19,F$21,F$23,F$25,F$27,F$29,F$31,F$33,F$35,F$37,F$39,F$41,F$43,F$45,F$47,F$49,F$51,F$53,F$55,F$57,F$59,F$61,F$63,F$65,F$67,F$69,F$71,F$73,F$75,F$77,F$79,F$81,F$83,F$85,F$87,F$89,F$91,F$93,F$95,F$97,F$99,F$101,F$103,F$105,F$107,F$109,F$111,F$113,F$115,F$117,F$119,F$121,F$123,F$125)) -> 4 | G15: =RANK(G14,(G$6,G$8,G$10,G$12,G$14,G$16,G$19,G$21,G$23,G$25,G$27,G$29,G$31,G$33,G$35,G$37,G$39,G$41,G$43,G$45,G$47,G$49,G$51,G$53,G$55,G$57,G$59,G$61,G$63,G$65,G$67,G$69,G$71,G$73,G$75,G$77,G$79,G$81,G$83,G$85,G$87,G$89,G$91,G$93,G$95,G$97,G$99,G$101,G$103,G$105,G$107,G$109,G$111,G$113,G$115,G$117,G$119,G$121,G$123,G$125)) -> 3 | H15: =RANK(H14,(H$6,H$8,H$10,H$12,H$14,H$16,H$19,H$21,H$23,H$25,H$27,H$29,H$31,H$33,H$35,H$37,H$39,H$41,H$43,H$45,H$47,H$49,H$51,H$53,H$55,H$57,H$59,H$61,H$63,H$65,H$67,H$69,H$71,H$73,H$75,H$77,H$79,H$81,H$83,H$85,H$87,H$89,H$91,H$93,H$95,H$97,H$99,H$101,H$103,H$105,H$107,H$109,H$111,H$113,H$115,H$117,H$119,H$121,H$123,H$125)) -> 5 | I15: =RANK(I14,(I$6,I$8,I$10,I$12,I$14,I$16,I$19,I$21,I$23,I$25,I$27,I$29,I$31,I$33,I$35,I$37,I$39,I$41,I$43,I$45,I$47,I$49,I$51,I$53,I$55,I$57,I$59,I$61,I$63,I$65,I$67,I$69,I$71,I$73,I$75,I$77,I$79,I$81,I$83,I$85,I$87,I$89,I$91,I$93,I$95,I$97,I$99,I$101,I$103,I$105,I$107,I$109,I$111,I$113,I$115,I$117,I$119,I$121,I$123,I$125)) -> 3 | J15: =RANK(J14,(J$6,J$8,J$10,J$12,J$14,J$16,J$19,J$21,J$23,J$25,J$27,J$29,J$31,J$33,J$35,J$37,J$39,J$41,J$43,J$45,J$47,J$49,J$51,J$53,J$55,J$57,J$59,J$61,J$63,J$65,J$67,J$69,J$71,J$73,J$75,J$77,J$79,J$81,J$83,J$85,J$87,J$89,J$91,J$93,J$95,J$97,J$99,J$101,J$103,J$105,J$107,J$109,J$111,J$113,J$115,J$117,J$119,J$121,J$123,J$125)) -> 4 | K15: =RANK(K14,(K$6,K$8,K$10,K$12,K$14,K$16,K$19,K$21,K$23,K$25,K$27,K$29,K$31,K$33,K$35,K$37,K$39,K$41,K$43,K$45,K$47,K$49,K$51,K$53,K$55,K$57,K$59,K$61,K$63,K$65,K$67,K$69,K$71,K$73,K$75,K$77,K$79,K$81,K$83,K$85,K$87,K$89,K$91,K$93,K$95,K$97,K$99,K$101,K$103,K$105,K$107,K$109,K$111,K$113,K$115,K$117,K$119,K$121,K$123,K$125)) -> 3 | L15: =RANK(L14,(L$6,L$8,L$10,L$12,L$14,L$16,L$19,L$21,L$23,L$25,L$27,L$29,L$31,L$33,L$35,L$37,L$39,L$41,L$43,L$45,L$47,L$49,L$51,L$53,L$55,L$57,L$59,L$61,L$63,L$65,L$67,L$69,L$71,L$73,L$75,L$77,L$79,L$81,L$83,L$85,L$87,L$89,L$91,L$93,L$95,L$97,L$99,L$101,L$103,L$105,L$107,L$109,L$111,L$113,L$115,L$117,L$119,L$121,L$123,L$125)) -> 4 | M15: =RANK(M14,(M$6,M$8,M$10,M$12,M$14,M$16,M$19,M$21,M$23,M$25,M$27,M$29,M$31,M$33,M$35,M$37,M$39,M$41,M$43,M$45,M$47,M$49,M$51,M$53,M$55,M$57,M$59,M$61,M$63,M$65,M$67,M$69,M$71,M$73,M$75,M$77,M$79,M$81,M$83,M$85,M$87,M$89,M$91,M$93,M$95,M$97,M$99,M$101,M$103,M$105,M$107,M$109,M$111,M$113,M$115,M$117,M$119,M$121,M$123,M$125)) -> 4 | N15: =RANK(N14,(N$6,N$8,N$10,N$12,N$14,N$16,N$19,N$21,N$23,N$25,N$27,N$29,N$31,N$33,N$35,N$37,N$39,N$41,N$43,N$45,N$47,N$49,N$51,N$53,N$55,N$57,N$59,N$61,N$63,N$65,N$67,N$69,N$71,N$73,N$75,N$77,N$79,N$81,N$83,N$85,N$87,N$89,N$91,N$93,N$95,N$97,N$99,N$101,N$103,N$105,N$107,N$109,N$111,N$113,N$115,N$117,N$119,N$121,N$123,N$125)) -> 5 | P15: =RANK(P14,(P$6,P$8,P$10,P$12,P$14,P$16,P$19,P$21,P$23,P$25,P$27,P$29,P$31,P$33,P$35,P$37,P$39,P$41,P$43,P$45,P$47,P$49,P$51,P$53,P$55,P$57,P$59,P$61,P$63,P$65,P$67,P$69,P$71,P$73,P$75,P$77,P$79,P$81,P$83,P$85,P$87,P$89,P$91,P$93,P$95,P$97,P$99,P$101,P$103,P$105,P$107,P$109,P$111,P$113,P$115,P$117,P$119,P$121,P$123,P$125)) -> 5
A16: Madison | B16: 1 | C16: 14.60 | D16: 15.00 | E16: 29.60 | F16: 15.30 | G16: 14.80 | H16: 15.50 | I16: 22.80 | J16: 15.30 | K16: 15.40 | L16: 14.00 | M16: 22.35 | N16: 74.75 | O16: 0.0 | P16: 74.75
A17: Scouts | C17: =RANK(C16,(C$6,C$8,C$10,C$12,C$14,C$16,C$19,C$21,C$23,C$25,C$27,C$29,C$31,C$33,C$35,C$37,C$39,C$41,C$43,C$45,C$47,C$49,C$51,C$53,C$55,C$57,C$59,C$61,C$63,C$65,C$67,C$69,C$71,C$73,C$75,C$77,C$79,C$81,C$83,C$85,C$87,C$89,C$91,C$93,C$95,C$97,C$99,C$101,C$103,C$105,C$107,C$109,C$111,C$113,C$115,C$117,C$119,C$121,C$123,C$125)) -> 6 | D17: =RANK(D16,(D$6,D$8,D$10,D$12,D$14,D$16,D$19,D$21,D$23,D$25,D$27,D$29,D$31,D$33,D$35,D$37,D$39,D$41,D$43,D$45,D$47,D$49,D$51,D$53,D$55,D$57,D$59,D$61,D$63,D$65,D$67,D$69,D$71,D$73,D$75,D$77,D$79,D$81,D$83,D$85,D$87,D$89,D$91,D$93,D$95,D$97,D$99,D$101,D$103,D$105,D$107,D$109,D$111,D$113,D$115,D$117,D$119,D$121,D$123,D$125)) -> 6 | E17: =RANK(E16,(E$6,E$8,E$10,E$12,E$14,E$16,E$19,E$21,E$23,E$25,E$27,E$29,E$31,E$33,E$35,E$37,E$39,E$41,E$43,E$45,E$47,E$49,E$51,E$53,E$55,E$57,E$59,E$61,E$63,E$65,E$67,E$69,E$71,E$73,E$75,E$77,E$79,E$81,E$83,E$85,E$87,E$89,E$91,E$93,E$95,E$97,E$99,E$101,E$103,E$105,E$107,E$109,E$111,E$113,E$115,E$117,E$119,E$121,E$123,E$125)) -> 6 | F17: =RANK(F16,(F$6,F$8,F$10,F$12,F$14,F$16,F$19,F$21,F$23,F$25,F$27,F$29,F$31,F$33,F$35,F$37,F$39,F$41,F$43,F$45,F$47,F$49,F$51,F$53,F$55,F$57,F$59,F$61,F$63,F$65,F$67,F$69,F$71,F$73,F$75,F$77,F$79,F$81,F$83,F$85,F$87,F$89,F$91,F$93,F$95,F$97,F$99,F$101,F$103,F$105,F$107,F$109,F$111,F$113,F$115,F$117,F$119,F$121,F$123,F$125)) -> 6 | G17: =RANK(G16,(G$6,G$8,G$10,G$12,G$14,G$16,G$19,G$21,G$23,G$25,G$27,G$29,G$31,G$33,G$35,G$37,G$39,G$41,G$43,G$45,G$47,G$49,G$51,G$53,G$55,G$57,G$59,G$61,G$63,G$65,G$67,G$69,G$71,G$73,G$75,G$77,G$79,G$81,G$83,G$85,G$87,G$89,G$91,G$93,G$95,G$97,G$99,G$101,G$103,G$105,G$107,G$109,G$111,G$113,G$115,G$117,G$119,G$121,G$123,G$125)) -> 6 | H17: =RANK(H16,(H$6,H$8,H$10,H$12,H$14,H$16,H$19,H$21,H$23,H$25,H$27,H$29,H$31,H$33,H$35,H$37,H$39,H$41,H$43,H$45,H$47,H$49,H$51,H$53,H$55,H$57,H$59,H$61,H$63,H$65,H$67,H$69,H$71,H$73,H$75,H$77,H$79,H$81,H$83,H$85,H$87,H$89,H$91,H$93,H$95,H$97,H$99,H$101,H$103,H$105,H$107,H$109,H$111,H$113,H$115,H$117,H$119,H$121,H$123,H$125)) -> 6 | I17: =RANK(I16,(I$6,I$8,I$10,I$12,I$14,I$16,I$19,I$21,I$23,I$25,I$27,I$29,I$31,I$33,I$35,I$37,I$39,I$41,I$43,I$45,I$47,I$49,I$51,I$53,I$55,I$57,I$59,I$61,I$63,I$65,I$67,I$69,I$71,I$73,I$75,I$77,I$79,I$81,I$83,I$85,I$87,I$89,I$91,I$93,I$95,I$97,I$99,I$101,I$103,I$105,I$107,I$109,I$111,I$113,I$115,I$117,I$119,I$121,I$123,I$125)) -> 6 | J17: =RANK(J16,(J$6,J$8,J$10,J$12,J$14,J$16,J$19,J$21,J$23,J$25,J$27,J$29,J$31,J$33,J$35,J$37,J$39,J$41,J$43,J$45,J$47,J$49,J$51,J$53,J$55,J$57,J$59,J$61,J$63,J$65,J$67,J$69,J$71,J$73,J$75,J$77,J$79,J$81,J$83,J$85,J$87,J$89,J$91,J$93,J$95,J$97,J$99,J$101,J$103,J$105,J$107,J$109,J$111,J$113,J$115,J$117,J$119,J$121,J$123,J$125)) -> 6 | K17: =RANK(K16,(K$6,K$8,K$10,K$12,K$14,K$16,K$19,K$21,K$23,K$25,K$27,K$29,K$31,K$33,K$35,K$37,K$39,K$41,K$43,K$45,K$47,K$49,K$51,K$53,K$55,K$57,K$59,K$61,K$63,K$65,K$67,K$69,K$71,K$73,K$75,K$77,K$79,K$81,K$83,K$85,K$87,K$89,K$91,K$93,K$95,K$97,K$99,K$101,K$103,K$105,K$107,K$109,K$111,K$113,K$115,K$117,K$119,K$121,K$123,K$125)) -> 6 | L17: =RANK(L16,(L$6,L$8,L$10,L$12,L$14,L$16,L$19,L$21,L$23,L$25,L$27,L$29,L$31,L$33,L$35,L$37,L$39,L$41,L$43,L$45,L$47,L$49,L$51,L$53,L$55,L$57,L$59,L$61,L$63,L$65,L$67,L$69,L$71,L$73,L$75,L$77,L$79,L$81,L$83,L$85,L$87,L$89,L$91,L$93,L$95,L$97,L$99,L$101,L$103,L$105,L$107,L$109,L$111,L$113,L$115,L$117,L$119,L$121,L$123,L$125)) -> 6 | M17: =RANK(M16,(M$6,M$8,M$10,M$12,M$14,M$16,M$19,M$21,M$23,M$25,M$27,M$29,M$31,M$33,M$35,M$37,M$39,M$41,M$43,M$45,M$47,M$49,M$51,M$53,M$55,M$57,M$59,M$61,M$63,M$65,M$67,M$69,M$71,M$73,M$75,M$77,M$79,M$81,M$83,M$85,M$87,M$89,M$91,M$93,M$95,M$97,M$99,M$101,M$103,M$105,M$107,M$109,M$111,M$113,M$115,M$117,M$119,M$121,M$123,M$125)) -> 6 | N17: =RANK(N16,(N$6,N$8,N$10,N$12,N$14,N$16,N$19,N$21,N$23,N$25,N$27,N$29,N$31,N$33,N$35,N$37,N$39,N$41,N$43,N$45,N$47,N$49,N$51,N$53,N$55,N$57,N$59,N$61,N$63,N$65,N$67,N$69,N$71,N$73,N$75,N$77,N$79,N$81,N$83,N$85,N$87,N$89,N$91,N$93,N$95,N$97,N$99,N$101,N$103,N$105,N$107,N$109,N$111,N$113,N$115,N$117,N$119,N$121,N$123,N$125)) -> 6 | P17: =RANK(P16,(P$6,P$8,P$10,P$12,P$14,P$16,P$19,P$21,P$23,P$25,P$27,P$29,P$31,P$33,P$35,P$37,P$39,P$41,P$43,P$45,P$47,P$49,P$51,P$53,P$55,P$57,P$59,P$61,P$63,P$65,P$67,P$69,P$71,P$73,P$75,P$77,P$79,P$81,P$83,P$85,P$87,P$89,P$91,P$93,P$95,P$97,P$99,P$101,P$103,P$105,P$107,P$109,P$111,P$113,P$115,P$117,P$119,P$121,P$123,P$125)) -> 6
A18: DCI Open Class
A19: Spartans | B19: 1 | C19: 14.00 | D19: 13.90 | E19: 27.90 | F19: 13.80 | G19: 13.90 | H19: 14.20 | I19: 20.95 | J19: 13.80 | K19: 13.80 | L19: 13.00 | M19: 20.30 | N19: 69.15 | O19: 0.0 | P19: 69.15
C20: 1 | D20: 1 | E20: 1 | F20: 1 | G20: 1 | H20: 1 | I20: 1 | J20: 1 | K20: 1 | L20: 1 | M20: 1 | N20: 1 | P20: 1