A1: 6/26/2024 Rockford, Michigan
C2: General Effect | F2: Visual | J2: Music
C3: 1 | D3: 2 | F3: Proficiency | G3: Analysis | H3: Color Guard | J3: Brass | K3: Analysis | L3: Percussion | N3: Sub | P3: Total
C4: M. Tarr | D4: K. Weirich | E4: Total | F4: J. Orefice | G4: B. Kuhn | H4: D. Deems | I4: Total ÷2 | J4: P. McGarr | K4: A. Cook | L4: M. Leitzke | M4: Total ÷2 | N4: Total | O4: Pen | P4: Score
A5: DCI World Class | C5: 20 | D5: 20 | E5: 40 | F5: 20 | G5: 20 | H5: 20 | I5: 30 | J5: 20 | K5: 20 | L5: 20 | M5: 30 | N5: 100 | P5: 100
A6: Boston | B6: 5 | C6: 15.40 | D6: 14.40 | E6: 29.80 | F6: 14.50 | G6: 14.30 | H6: 14.50 | I6: 21.65 | J6: 14.30 | K6: 14.70 | L6: 14.10 | M6: 21.55 | N6: 73.00 | O6: 0.0 | P6: 73.00
A7: Crusaders | C7: =RANK(C6,(C$6,C$8,C$10,C$12,C$14,C$16,C$18,C$20,C$22,C$24,C$26,C$28,C$30,C$32,C$34,C$36,C$38,C$40,C$42,C$44,C$46,C$48,C$50,C$52,C$54,C$56,C$58,C$60,C$62,C$64,C$66,C$68,C$70,C$72,C$74,C$76,C$78,C$80,C$82,C$84,C$86,C$88,C$90,C$92,C$94,C$96,C$98,C$100,C$102,C$104,C$106,C$108,C$110,C$112,C$114,C$116,C$118,C$120,C$122,C$124)) -> 1 | D7: =RANK(D6,(D$6,D$8,D$10,D$12,D$14,D$16,D$18,D$20,D$22,D$24,D$26,D$28,D$30,D$32,D$34,D$36,D$38,D$40,D$42,D$44,D$46,D$48,D$50,D$52,D$54,D$56,D$58,D$60,D$62,D$64,D$66,D$68,D$70,D$72,D$74,D$76,D$78,D$80,D$82,D$84,D$86,D$88,D$90,D$92,D$94,D$96,D$98,D$100,D$102,D$104,D$106,D$108,D$110,D$112,D$114,D$116,D$118,D$120,D$122,D$124)) -> 1 | E7: =RANK(E6,(E$6,E$8,E$10,E$12,E$14,E$16,E$18,E$20,E$22,E$24,E$26,E$28,E$30,E$32,E$34,E$36,E$38,E$40,E$42,E$44,E$46,E$48,E$50,E$52,E$54,E$56,E$58,E$60,E$62,E$64,E$66,E$68,E$70,E$72,E$74,E$76,E$78,E$80,E$82,E$84,E$86,E$88,E$90,E$92,E$94,E$96,E$98,E$100,E$102,E$104,E$106,E$108,E$110,E$112,E$114,E$116,E$118,E$120,E$122,E$124)) -> 1 | F7: =RANK(F6,(F$6,F$8,F$10,F$12,F$14,F$16,F$18,F$20,F$22,F$24,F$26,F$28,F$30,F$32,F$34,F$36,F$38,F$40,F$42,F$44,F$46,F$48,F$50,F$52,F$54,F$56,F$58,F$60,F$62,F$64,F$66,F$68,F$70,F$72,F$74,F$76,F$78,F$80,F$82,F$84,F$86,F$88,F$90,F$92,F$94,F$96,F$98,F$100,F$102,F$104,F$106,F$108,F$110,F$112,F$114,F$116,F$118,F$120,F$122,F$124)) -> 1 | G7: =RANK(G6,(G$6,G$8,G$10,G$12,G$14,G$16,G$18,G$20,G$22,G$24,G$26,G$28,G$30,G$32,G$34,G$36,G$38,G$40,G$42,G$44,G$46,G$48,G$50,G$52,G$54,G$56,G$58,G$60,G$62,G$64,G$66,G$68,G$70,G$72,G$74,G$76,G$78,G$80,G$82,G$84,G$86,G$88,G$90,G$92,G$94,G$96,G$98,G$100,G$102,G$104,G$106,G$108,G$110,G$112,G$114,G$116,G$118,G$120,G$122,G$124)) -> 1 | H7: =RANK(H6,(H$6,H$8,H$10,H$12,H$14,H$16,H$18,H$20,H$22,H$24,H$26,H$28,H$30,H$32,H$34,H$36,H$38,H$40,H$42,H$44,H$46,H$48,H$50,H$52,H$54,H$56,H$58,H$60,H$62,H$64,H$66,H$68,H$70,H$72,H$74,H$76,H$78,H$80,H$82,H$84,H$86,H$88,H$90,H$92,H$94,H$96,H$98,H$100,H$102,H$104,H$106,H$108,H$110,H$112,H$114,H$116,H$118,H$120,H$122,H$124)) -> 1 | I7: =RANK(I6,(I$6,I$8,I$10,I$12,I$14,I$16,I$18,I$20,I$22,I$24,I$26,I$28,I$30,I$32,I$34,I$36,I$38,I$40,I$42,I$44,I$46,I$48,I$50,I$52,I$54,I$56,I$58,I$60,I$62,I$64,I$66,I$68,I$70,I$72,I$74,I$76,I$78,I$80,I$82,I$84,I$86,I$88,I$90,I$92,I$94,I$96,I$98,I$100,I$102,I$104,I$106,I$108,I$110,I$112,I$114,I$116,I$118,I$120,I$122,I$124)) -> 1 | J7: =RANK(J6,(J$6,J$8,J$10,J$12,J$14,J$16,J$18,J$20,J$22,J$24,J$26,J$28,J$30,J$32,J$34,J$36,J$38,J$40,J$42,J$44,J$46,J$48,J$50,J$52,J$54,J$56,J$58,J$60,J$62,J$64,J$66,J$68,J$70,J$72,J$74,J$76,J$78,J$80,J$82,J$84,J$86,J$88,J$90,J$92,J$94,J$96,J$98,J$100,J$102,J$104,J$106,J$108,J$110,J$112,J$114,J$116,J$118,J$120,J$122,J$124)) -> 1 | K7: =RANK(K6,(K$6,K$8,K$10,K$12,K$14,K$16,K$18,K$20,K$22,K$24,K$26,K$28,K$30,K$32,K$34,K$36,K$38,K$40,K$42,K$44,K$46,K$48,K$50,K$52,K$54,K$56,K$58,K$60,K$62,K$64,K$66,K$68,K$70,K$72,K$74,K$76,K$78,K$80,K$82,K$84,K$86,K$88,K$90,K$92,K$94,K$96,K$98,K$100,K$102,K$104,K$106,K$108,K$110,K$112,K$114,K$116,K$118,K$120,K$122,K$124)) -> 1 | L7: =RANK(L6,(L$6,L$8,L$10,L$12,L$14,L$16,L$18,L$20,L$22,L$24,L$26,L$28,L$30,L$32,L$34,L$36,L$38,L$40,L$42,L$44,L$46,L$48,L$50,L$52,L$54,L$56,L$58,L$60,L$62,L$64,L$66,L$68,L$70,L$72,L$74,L$76,L$78,L$80,L$82,L$84,L$86,L$88,L$90,L$92,L$94,L$96,L$98,L$100,L$102,L$104,L$106,L$108,L$110,L$112,L$114,L$116,L$118,L$120,L$122,L$124)) -> 1 | M7: =RANK(M6,(M$6,M$8,M$10,M$12,M$14,M$16,M$18,M$20,M$22,M$24,M$26,M$28,M$30,M$32,M$34,M$36,M$38,M$40,M$42,M$44,M$46,M$48,M$50,M$52,M$54,M$56,M$58,M$60,M$62,M$64,M$66,M$68,M$70,M$72,M$74,M$76,M$78,M$80,M$82,M$84,M$86,M$88,M$90,M$92,M$94,M$96,M$98,M$100,M$102,M$104,M$106,M$108,M$110,M$112,M$114,M$116,M$118,M$120,M$122,M$124)) -> 1 | N7: =RANK(N6,(N$6,N$8,N$10,N$12,N$14,N$16,N$18,N$20,N$22,N$24,N$26,N$28,N$30,N$32,N$34,N$36,N$38,N$40,N$42,N$44,N$46,N$48,N$50,N$52,N$54,N$56,N$58,N$60,N$62,N$64,N$66,N$68,N$70,N$72,N$74,N$76,N$78,N$80,N$82,N$84,N$86,N$88,N$90,N$92,N$94,N$96,N$98,N$100,N$102,N$104,N$106,N$108,N$110,N$112,N$114,N$116,N$118,N$120,N$122,N$124)) -> 1 | P7: =RANK(P6,(P$6,P$8,P$10,P$12,P$14,P$16,P$18,P$20,P$22,P$24,P$26,P$28,P$30,P$32,P$34,P$36,P$38,P$40,P$42,P$44,P$46,P$48,P$50,P$52,P$54,P$56,P$58,P$60,P$62,P$64,P$66,P$68,P$70,P$72,P$74,P$76,P$78,P$80,P$82,P$84,P$86,P$88,P$90,P$92,P$94,P$96,P$98,P$100,P$102,P$104,P$106,P$108,P$110,P$112,P$114,P$116,P$118,P$120,P$122,P$124)) -> 1
A8: Phantom | B8: 2 | C8: 14.80 | D8: 14.20 | E8: 29.00 | F8: 14.00 | G8: 13.60 | H8: 13.60 | I8: 20.60 | J8: 13.80 | K8: 14.20 | L8: 13.10 | M8: 20.55 | N8: 70.15 | O8: 0.0 | P8: 70.15
A9: Regiment | C9: =RANK(C8,(C$6,C$8,C$10,C$12,C$14,C$16,C$18,C$20,C$22,C$24,C$26,C$28,C$30,C$32,C$34,C$36,C$38,C$40,C$42,C$44,C$46,C$48,C$50,C$52,C$54,C$56,C$58,C$60,C$62,C$64,C$66,C$68,C$70,C$72,C$74,C$76,C$78,C$80,C$82,C$84,C$86,C$88,C$90,C$92,C$94,C$96,C$98,C$100,C$102,C$104,C$106,C$108,C$110,C$112,C$114,C$116,C$118,C$120,C$122,C$124)) -> 2 | D9: =RANK(D8,(D$6,D$8,D$10,D$12,D$14,D$16,D$18,D$20,D$22,D$24,D$26,D$28,D$30,D$32,D$34,D$36,D$38,D$40,D$42,D$44,D$46,D$48,D$50,D$52,D$54,D$56,D$58,D$60,D$62,D$64,D$66,D$68,D$70,D$72,D$74,D$76,D$78,D$80,D$82,D$84,D$86,D$88,D$90,D$92,D$94,D$96,D$98,D$100,D$102,D$104,D$106,D$108,D$110,D$112,D$114,D$116,D$118,D$120,D$122,D$124)) -> 2 | E9: =RANK(E8,(E$6,E$8,E$10,E$12,E$14,E$16,E$18,E$20,E$22,E$24,E$26,E$28,E$30,E$32,E$34,E$36,E$38,E$40,E$42,E$44,E$46,E$48,E$50,E$52,E$54,E$56,E$58,E$60,E$62,E$64,E$66,E$68,E$70,E$72,E$74,E$76,E$78,E$80,E$82,E$84,E$86,E$88,E$90,E$92,E$94,E$96,E$98,E$100,E$102,E$104,E$106,E$108,E$110,E$112,E$114,E$116,E$118,E$120,E$122,E$124)) -> 2 | F9: =RANK(F8,(F$6,F$8,F$10,F$12,F$14,F$16,F$18,F$20,F$22,F$24,F$26,F$28,F$30,F$32,F$34,F$36,F$38,F$40,F$42,F$44,F$46,F$48,F$50,F$52,F$54,F$56,F$58,F$60,F$62,F$64,F$66,F$68,F$70,F$72,F$74,F$76,F$78,F$80,F$82,F$84,F$86,F$88,F$90,F$92,F$94,F$96,F$98,F$100,F$102,F$104,F$106,F$108,F$110,F$112,F$114,F$116,F$118,F$120,F$122,F$124)) -> 2 | G9: =RANK(G8,(G$6,G$8,G$10,G$12,G$14,G$16,G$18,G$20,G$22,G$24,G$26,G$28,G$30,G$32,G$34,G$36,G$38,G$40,G$42,G$44,G$46,G$48,G$50,G$52,G$54,G$56,G$58,G$60,G$62,G$64,G$66,G$68,G$70,G$72,G$74,G$76,G$78,G$80,G$82,G$84,G$86,G$88,G$90,G$92,G$94,G$96,G$98,G$100,G$102,G$104,G$106,G$108,G$110,G$112,G$114,G$116,G$118,G$120,G$122,G$124)) -> 2 | H9: =RANK(H8,(H$6,H$8,H$10,H$12,H$14,H$16,H$18,H$20,H$22,H$24,H$26,H$28,H$30,H$32,H$34,H$36,H$38,H$40,H$42,H$44,H$46,H$48,H$50,H$52,H$54,H$56,H$58,H$60,H$62,H$64,H$66,H$68,H$70,H$72,H$74,H$76,H$78,H$80,H$82,H$84,H$86,H$88,H$90,H$92,H$94,H$96,H$98,H$100,H$102,H$104,H$106,H$108,H$110,H$112,H$114,H$116,H$118,H$120,H$122,H$124)) -> 2 | I9: =RANK(I8,(I$6,I$8,I$10,I$12,I$14,I$16,I$18,I$20,I$22,I$24,I$26,I$28,I$30,I$32,I$34,I$36,I$38,I$40,I$42,I$44,I$46,I$48,I$50,I$52,I$54,I$56,I$58,I$60,I$62,I$64,I$66,I$68,I$70,I$72,I$74,I$76,I$78,I$80,I$82,I$84,I$86,I$88,I$90,I$92,I$94,I$96,I$98,I$100,I$102,I$104,I$106,I$108,I$110,I$112,I$114,I$116,I$118,I$120,I$122,I$124)) -> 2 | J9: =RANK(J8,(J$6,J$8,J$10,J$12,J$14,J$16,J$18,J$20,J$22,J$24,J$26,J$28,J$30,J$32,J$34,J$36,J$38,J$40,J$42,J$44,J$46,J$48,J$50,J$52,J$54,J$56,J$58,J$60,J$62,J$64,J$66,J$68,J$70,J$72,J$74,J$76,J$78,J$80,J$82,J$84,J$86,J$88,J$90,J$92,J$94,J$96,J$98,J$100,J$102,J$104,J$106,J$108,J$110,J$112,J$114,J$116,J$118,J$120,J$122,J$124)) -> 2 | K9: =RANK(K8,(K$6,K$8,K$10,K$12,K$14,K$16,K$18,K$20,K$22,K$24,K$26,K$28,K$30,K$32,K$34,K$36,K$38,K$40,K$42,K$44,K$46,K$48,K$50,K$52,K$54,K$56,K$58,K$60,K$62,K$64,K$66,K$68,K$70,K$72,K$74,K$76,K$78,K$80,K$82,K$84,K$86,K$88,K$90,K$92,K$94,K$96,K$98,K$100,K$102,K$104,K$106,K$108,K$110,K$112,K$114,K$116,K$118,K$120,K$122,K$124)) -> 2 | L9: =RANK(L8,(L$6,L$8,L$10,L$12,L$14,L$16,L$18,L$20,L$22,L$24,L$26,L$28,L$30,L$32,L$34,L$36,L$38,L$40,L$42,L$44,L$46,L$48,L$50,L$52,L$54,L$56,L$58,L$60,L$62,L$64,L$66,L$68,L$70,L$72,L$74,L$76,L$78,L$80,L$82,L$84,L$86,L$88,L$90,L$92,L$94,L$96,L$98,L$100,L$102,L$104,L$106,L$108,L$110,L$112,L$114,L$116,L$118,L$120,L$122,L$124)) -> 3 | M9: =RANK(M8,(M$6,M$8,M$10,M$12,M$14,M$16,M$18,M$20,M$22,M$24,M$26,M$28,M$30,M$32,M$34,M$36,M$38,M$40,M$42,M$44,M$46,M$48,M$50,M$52,M$54,M$56,M$58,M$60,M$62,M$64,M$66,M$68,M$70,M$72,M$74,M$76,M$78,M$80,M$82,M$84,M$86,M$88,M$90,M$92,M$94,M$96,M$98,M$100,M$102,M$104,M$106,M$108,M$110,M$112,M$114,M$116,M$118,M$120,M$122,M$124)) -> 3 | N9: =RANK(N8,(N$6,N$8,N$10,N$12,N$14,N$16,N$18,N$20,N$22,N$24,N$26,N$28,N$30,N$32,N$34,N$36,N$38,N$40,N$42,N$44,N$46,N$48,N$50,N$52,N$54,N$56,N$58,N$60,N$62,N$64,N$66,N$68,N$70,N$72,N$74,N$76,N$78,N$80,N$82,N$84,N$86,N$88,N$90,N$92,N$94,N$96,N$98,N$100,N$102,N$104,N$106,N$108,N$110,N$112,N$114,N$116,N$118,N$120,N$122,N$124)) -> 2 | P9: =RANK(P8,(P$6,P$8,P$10,P$12,P$14,P$16,P$18,P$20,P$22,P$24,P$26,P$28,P$30,P$32,P$34,P$36,P$38,P$40,P$42,P$44,P$46,P$48,P$50,P$52,P$54,P$56,P$58,P$60,P$62,P$64,P$66,P$68,P$70,P$72,P$74,P$76,P$78,P$80,P$82,P$84,P$86,P$88,P$90,P$92,P$94,P$96,P$98,P$100,P$102,P$104,P$106,P$108,P$110,P$112,P$114,P$116,P$118,P$120,P$122,P$124)) -> 2
A10: Cavaliers | B10: 4 | C10: 13.70 | D10: 13.90 | E10: 27.60 | F10: 13.80 | G10: 13.30 | H10: 12.90 | I10: 20.00 | J10: 13.40 | K10: 14.10 | L10: 13.80 | M10: 20.65 | N10: 68.25 | O10: 0.0 | P10: 68.25
C11: =RANK(C10,(C$6,C$8,C$10,C$12,C$14,C$16,C$18,C$20,C$22,C$24,C$26,C$28,C$30,C$32,C$34,C$36,C$38,C$40,C$42,C$44,C$46,C$48,C$50,C$52,C$54,C$56,C$58,C$60,C$62,C$64,C$66,C$68,C$70,C$72,C$74,C$76,C$78,C$80,C$82,C$84,C$86,C$88,C$90,C$92,C$94,C$96,C$98,C$100,C$102,C$104,C$106,C$108,C$110,C$112,C$114,C$116,C$118,C$120,C$122,C$124)) -> 5 | D11: =RANK(D10,(D$6,D$8,D$10,D$12,D$14,D$16,D$18,D$20,D$22,D$24,D$26,D$28,D$30,D$32,D$34,D$36,D$38,D$40,D$42,D$44,D$46,D$48,D$50,D$52,D$54,D$56,D$58,D$60,D$62,D$64,D$66,D$68,D$70,D$72,D$74,D$76,D$78,D$80,D$82,D$84,D$86,D$88,D$90,D$92,D$94,D$96,D$98,D$100,D$102,D$104,D$106,D$108,D$110,D$112,D$114,D$116,D$118,D$120,D$122,D$124)) -> 3 | E11: =RANK(E10,(E$6,E$8,E$10,E$12,E$14,E$16,E$18,E$20,E$22,E$24,E$26,E$28,E$30,E$32,E$34,E$36,E$38,E$40,E$42,E$44,E$46,E$48,E$50,E$52,E$54,E$56,E$58,E$60,E$62,E$64,E$66,E$68,E$70,E$72,E$74,E$76,E$78,E$80,E$82,E$84,E$86,E$88,E$90,E$92,E$94,E$96,E$98,E$100,E$102,E$104,E$106,E$108,E$110,E$112,E$114,E$116,E$118,E$120,E$122,E$124)) -> 3 | F11: =RANK(F10,(F$6,F$8,F$10,F$12,F$14,F$16,F$18,F$20,F$22,F$24,F$26,F$28,F$30,F$32,F$34,F$36,F$38,F$40,F$42,F$44,F$46,F$48,F$50,F$52,F$54,F$56,F$58,F$60,F$62,F$64,F$66,F$68,F$70,F$72,F$74,F$76,F$78,F$80,F$82,F$84,F$86,F$88,F$90,F$92,F$94,F$96,F$98,F$100,F$102,F$104,F$106,F$108,F$110,F$112,F$114,F$116,F$118,F$120,F$122,F$124)) -> 3 | G11: =RANK(G10,(G$6,G$8,G$10,G$12,G$14,G$16,G$18,G$20,G$22,G$24,G$26,G$28,G$30,G$32,G$34,G$36,G$38,G$40,G$42,G$44,G$46,G$48,G$50,G$52,G$54,G$56,G$58,G$60,G$62,G$64,G$66,G$68,G$70,G$72,G$74,G$76,G$78,G$80,G$82,G$84,G$86,G$88,G$90,G$92,G$94,G$96,G$98,G$100,G$102,G$104,G$106,G$108,G$110,G$112,G$114,G$116,G$118,G$120,G$122,G$124)) -> 3 | H11: =RANK(H10,(H$6,H$8,H$10,H$12,H$14,H$16,H$18,H$20,H$22,H$24,H$26,H$28,H$30,H$32,H$34,H$36,H$38,H$40,H$42,H$44,H$46,H$48,H$50,H$52,H$54,H$56,H$58,H$60,H$62,H$64,H$66,H$68,H$70,H$72,H$74,H$76,H$78,H$80,H$82,H$84,H$86,H$88,H$90,H$92,H$94,H$96,H$98,H$100,H$102,H$104,H$106,H$108,H$110,H$112,H$114,H$116,H$118,H$120,H$122,H$124)) -> 4 | I11: =RANK(I10,(I$6,I$8,I$10,I$12,I$14,I$16,I$18,I$20,I$22,I$24,I$26,I$28,I$30,I$32,I$34,I$36,I$38,I$40,I$42,I$44,I$46,I$48,I$50,I$52,I$54,I$56,I$58,I$60,I$62,I$64,I$66,I$68,I$70,I$72,I$74,I$76,I$78,I$80,I$82,I$84,I$86,I$88,I$90,I$92,I$94,I$96,I$98,I$100,I$102,I$104,I$106,I$108,I$110,I$112,I$114,I$116,I$118,I$120,I$122,I$124)) -> 3 | J11: =RANK(J10,(J$6,J$8,J$10,J$12,J$14,J$16,J$18,J$20,J$22,J$24,J$26,J$28,J$30,J$32,J$34,J$36,J$38,J$40,J$42,J$44,J$46,J$48,J$50,J$52,J$54,J$56,J$58,J$60,J$62,J$64,J$66,J$68,J$70,J$72,J$74,J$76,J$78,J$80,J$82,J$84,J$86,J$88,J$90,J$92,J$94,J$96,J$98,J$100,J$102,J$104,J$106,J$108,J$110,J$112,J$114,J$116,J$118,J$120,J$122,J$124)) -> 3 | K11: =RANK(K10,(K$6,K$8,K$10,K$12,K$14,K$16,K$18,K$20,K$22,K$24,K$26,K$28,K$30,K$32,K$34,K$36,K$38,K$40,K$42,K$44,K$46,K$48,K$50,K$52,K$54,K$56,K$58,K$60,K$62,K$64,K$66,K$68,K$70,K$72,K$74,K$76,K$78,K$80,K$82,K$84,K$86,K$88,K$90,K$92,K$94,K$96,K$98,K$100,K$102,K$104,K$106,K$108,K$110,K$112,K$114,K$116,K$118,K$120,K$122,K$124)) -> 3 | L11: =RANK(L10,(L$6,L$8,L$10,L$12,L$14,L$16,L$18,L$20,L$22,L$24,L$26,L$28,L$30,L$32,L$34,L$36,L$38,L$40,L$42,L$44,L$46,L$48,L$50,L$52,L$54,L$56,L$58,L$60,L$62,L$64,L$66,L$68,L$70,L$72,L$74,L$76,L$78,L$80,L$82,L$84,L$86,L$88,L$90,L$92,L$94,L$96,L$98,L$100,L$102,L$104,L$106,L$108,L$110,L$112,L$114,L$116,L$118,L$120,L$122,L$124)) -> 2 | M11: =RANK(M10,(M$6,M$8,M$10,M$12,M$14,M$16,M$18,M$20,M$22,M$24,M$26,M$28,M$30,M$32,M$34,M$36,M$38,M$40,M$42,M$44,M$46,M$48,M$50,M$52,M$54,M$56,M$58,M$60,M$62,M$64,M$66,M$68,M$70,M$72,M$74,M$76,M$78,M$80,M$82,M$84,M$86,M$88,M$90,M$92,M$94,M$96,M$98,M$100,M$102,M$104,M$106,M$108,M$110,M$112,M$114,M$116,M$118,M$120,M$122,M$124)) -> 2 | N11: =RANK(N10,(N$6,N$8,N$10,N$12,N$14,N$16,N$18,N$20,N$22,N$24,N$26,N$28,N$30,N$32,N$34,N$36,N$38,N$40,N$42,N$44,N$46,N$48,N$50,N$52,N$54,N$56,N$58,N$60,N$62,N$64,N$66,N$68,N$70,N$72,N$74,N$76,N$78,N$80,N$82,N$84,N$86,N$88,N$90,N$92,N$94,N$96,N$98,N$100,N$102,N$104,N$106,N$108,N$110,N$112,N$114,N$116,N$118,N$120,N$122,N$124)) -> 3 | P11: =RANK(P10,(P$6,P$8,P$10,P$12,P$14,P$16,P$18,P$20,P$22,P$24,P$26,P$28,P$30,P$32,P$34,P$36,P$38,P$40,P$42,P$44,P$46,P$48,P$50,P$52,P$54,P$56,P$58,P$60,P$62,P$64,P$66,P$68,P$70,P$72,P$74,P$76,P$78,P$80,P$82,P$84,P$86,P$88,P$90,P$92,P$94,P$96,P$98,P$100,P$102,P$104,P$106,P$108,P$110,P$112,P$114,P$116,P$118,P$120,P$122,P$124)) -> 3
A12: Blue | B12: 1 | C12: 14.10 | D12: 13.30 | E12: 27.40 | F12: 13.30 | G12: 12.80 | H12: 13.40 | I12: 19.75 | J12: 12.90 | K12: 13.60 | L12: 12.50 | M12: 19.50 | N12: 66.65 | O12: 0.0 | P12: 66.65
A13: Stars | C13: =RANK(C12,(C$6,C$8,C$10,C$12,C$14,C$16,C$18,C$20,C$22,C$24,C$26,C$28,C$30,C$32,C$34,C$36,C$38,C$40,C$42,C$44,C$46,C$48,C$50,C$52,C$54,C$56,C$58,C$60,C$62,C$64,C$66,C$68,C$70,C$72,C$74,C$76,C$78,C$80,C$82,C$84,C$86,C$88,C$90,C$92,C$94,C$96,C$98,C$100,C$102,C$104,C$106,C$108,C$110,C$112,C$114,C$116,C$118,C$120,C$122,C$124)) -> 3 | D13: =RANK(D12,(D$6,D$8,D$10,D$12,D$14,D$16,D$18,D$20,D$22,D$24,D$26,D$28,D$30,D$32,D$34,D$36,D$38,D$40,D$42,D$44,D$46,D$48,D$50,D$52,D$54,D$56,D$58,D$60,D$62,D$64,D$66,D$68,D$70,D$72,D$74,D$76,D$78,D$80,D$82,D$84,D$86,D$88,D$90,D$92,D$94,D$96,D$98,D$100,D$102,D$104,D$106,D$108,D$110,D$112,D$114,D$116,D$118,D$120,D$122,D$124)) -> 4 | E13: =RANK(E12,(E$6,E$8,E$10,E$12,E$14,E$16,E$18,E$20,E$22,E$24,E$26,E$28,E$30,E$32,E$34,E$36,E$38,E$40,E$42,E$44,E$46,E$48,E$50,E$52,E$54,E$56,E$58,E$60,E$62,E$64,E$66,E$68,E$70,E$72,E$74,E$76,E$78,E$80,E$82,E$84,E$86,E$88,E$90,E$92,E$94,E$96,E$98,E$100,E$102,E$104,E$106,E$108,E$110,E$112,E$114,E$116,E$118,E$120,E$122,E$124)) -> 4 | F13: =RANK(F12,(F$6,F$8,F$10,F$12,F$14,F$16,F$18,F$20,F$22,F$24,F$26,F$28,F$30,F$32,F$34,F$36,F$38,F$40,F$42,F$44,F$46,F$48,F$50,F$52,F$54,F$56,F$58,F$60,F$62,F$64,F$66,F$68,F$70,F$72,F$74,F$76,F$78,F$80,F$82,F$84,F$86,F$88,F$90,F$92,F$94,F$96,F$98,F$100,F$102,F$104,F$106,F$108,F$110,F$112,F$114,F$116,F$118,F$120,F$122,F$124)) -> 5 | G13: =RANK(G12,(G$6,G$8,G$10,G$12,G$14,G$16,G$18,G$20,G$22,G$24,G$26,G$28,G$30,G$32,G$34,G$36,G$38,G$40,G$42,G$44,G$46,G$48,G$50,G$52,G$54,G$56,G$58,G$60,G$62,G$64,G$66,G$68,G$70,G$72,G$74,G$76,G$78,G$80,G$82,G$84,G$86,G$88,G$90,G$92,G$94,G$96,G$98,G$100,G$102,G$104,G$106,G$108,G$110,G$112,G$114,G$116,G$118,G$120,G$122,G$124)) -> 4 | H13: =RANK(H12,(H$6,H$8,H$10,H$12,H$14,H$16,H$18,H$20,H$22,H$24,H$26,H$28,H$30,H$32,H$34,H$36,H$38,H$40,H$42,H$44,H$46,H$48,H$50,H$52,H$54,H$56,H$58,H$60,H$62,H$64,H$66,H$68,H$70,H$72,H$74,H$76,H$78,H$80,H$82,H$84,H$86,H$88,H$90,H$92,H$94,H$96,H$98,H$100,H$102,H$104,H$106,H$108,H$110,H$112,H$114,H$116,H$118,H$120,H$122,H$124)) -> 3 | I13: =RANK(I12,(I$6,I$8,I$10,I$12,I$14,I$16,I$18,I$20,I$22,I$24,I$26,I$28,I$30,I$32,I$34,I$36,I$38,I$40,I$42,I$44,I$46,I$48,I$50,I$52,I$54,I$56,I$58,I$60,I$62,I$64,I$66,I$68,I$70,I$72,I$74,I$76,I$78,I$80,I$82,I$84,I$86,I$88,I$90,I$92,I$94,I$96,I$98,I$100,I$102,I$104,I$106,I$108,I$110,I$112,I$114,I$116,I$118,I$120,I$122,I$124)) -> 4 | J13: =RANK(J12,(J$6,J$8,J$10,J$12,J$14,J$16,J$18,J$20,J$22,J$24,J$26,J$28,J$30,J$32,J$34,J$36,J$38,J$40,J$42,J$44,J$46,J$48,J$50,J$52,J$54,J$56,J$58,J$60,J$62,J$64,J$66,J$68,J$70,J$72,J$74,J$76,J$78,J$80,J$82,J$84,J$86,J$88,J$90,J$92,J$94,J$96,J$98,J$100,J$102,J$104,J$106,J$108,J$110,J$112,J$114,J$116,J$118,J$120,J$122,J$124)) -> 4 | K13: =RANK(K12,(K$6,K$8,K$10,K$12,K$14,K$16,K$18,K$20,K$22,K$24,K$26,K$28,K$30,K$32,K$34,K$36,K$38,K$40,K$42,K$44,K$46,K$48,K$50,K$52,K$54,K$56,K$58,K$60,K$62,K$64,K$66,K$68,K$70,K$72,K$74,K$76,K$78,K$80,K$82,K$84,K$86,K$88,K$90,K$92,K$94,K$96,K$98,K$100,K$102,K$104,K$106,K$108,K$110,K$112,K$114,K$116,K$118,K$120,K$122,K$124)) -> 4 | L13: =RANK(L12,(L$6,L$8,L$10,L$12,L$14,L$16,L$18,L$20,L$22,L$24,L$26,L$28,L$30,L$32,L$34,L$36,L$38,L$40,L$42,L$44,L$46,L$48,L$50,L$52,L$54,L$56,L$58,L$60,L$62,L$64,L$66,L$68,L$70,L$72,L$74,L$76,L$78,L$80,L$82,L$84,L$86,L$88,L$90,L$92,L$94,L$96,L$98,L$100,L$102,L$104,L$106,L$108,L$110,L$112,L$114,L$116,L$118,L$120,L$122,L$124)) -> 4 | M13: =RANK(M12,(M$6,M$8,M$10,M$12,M$14,M$16,M$18,M$20,M$22,M$24,M$26,M$28,M$30,M$32,M$34,M$36,M$38,M$40,M$42,M$44,M$46,M$48,M$50,M$52,M$54,M$56,M$58,M$60,M$62,M$64,M$66,M$68,M$70,M$72,M$74,M$76,M$78,M$80,M$82,M$84,M$86,M$88,M$90,M$92,M$94,M$96,M$98,M$100,M$102,M$104,M$106,M$108,M$110,M$112,M$114,M$116,M$118,M$120,M$122,M$124)) -> 4 | N13: =RANK(N12,(N$6,N$8,N$10,N$12,N$14,N$16,N$18,N$20,N$22,N$24,N$26,N$28,N$30,N$32,N$34,N$36,N$38,N$40,N$42,N$44,N$46,N$48,N$50,N$52,N$54,N$56,N$58,N$60,N$62,N$64,N$66,N$68,N$70,N$72,N$74,N$76,N$78,N$80,N$82,N$84,N$86,N$88,N$90,N$92,N$94,N$96,N$98,N$100,N$102,N$104,N$106,N$108,N$110,N$112,N$114,N$116,N$118,N$120,N$122,N$124)) -> 4 | P13: =RANK(P12,(P$6,P$8,P$10,P$12,P$14,P$16,P$18,P$20,P$22,P$24,P$26,P$28,P$30,P$32,P$34,P$36,P$38,P$40,P$42,P$44,P$46,P$48,P$50,P$52,P$54,P$56,P$58,P$60,P$62,P$64,P$66,P$68,P$70,P$72,P$74,P$76,P$78,P$80,P$82,P$84,P$86,P$88,P$90,P$92,P$94,P$96,P$98,P$100,P$102,P$104,P$106,P$108,P$110,P$112,P$114,P$116,P$118,P$120,P$122,P$124)) -> 4
A14: Colts | B14: 3 | C14: 13.80 | D14: 13.00 | E14: 26.80 | F14: 13.40 | G14: 12.60 | H14: 12.80 | I14: 19.40 | J14: 12.70 | K14: 13.30 | L14: 12.40 | M14: 19.20 | N14: 65.40 | O14: 0.0 | P14: 65.40
C15: =RANK(C14,(C$6,C$8,C$10,C$12,C$14,C$16,C$18,C$20,C$22,C$24,C$26,C$28,C$30,C$32,C$34,C$36,C$38,C$40,C$42,C$44,C$46,C$48,C$50,C$52,C$54,C$56,C$58,C$60,C$62,C$64,C$66,C$68,C$70,C$72,C$74,C$76,C$78,C$80,C$82,C$84,C$86,C$88,C$90,C$92,C$94,C$96,C$98,C$100,C$102,C$104,C$106,C$108,C$110,C$112,C$114,C$116,C$118,C$120,C$122,C$124)) -> 4 | D15: =RANK(D14,(D$6,D$8,D$10,D$12,D$14,D$16,D$18,D$20,D$22,D$24,D$26,D$28,D$30,D$32,D$34,D$36,D$38,D$40,D$42,D$44,D$46,D$48,D$50,D$52,D$54,D$56,D$58,D$60,D$62,D$64,D$66,D$68,D$70,D$72,D$74,D$76,D$78,D$80,D$82,D$84,D$86,D$88,D$90,D$92,D$94,D$96,D$98,D$100,D$102,D$104,D$106,D$108,D$110,D$112,D$114,D$116,D$118,D$120,D$122,D$124)) -> 5 | E15: =RANK(E14,(E$6,E$8,E$10,E$12,E$14,E$16,E$18,E$20,E$22,E$24,E$26,E$28,E$30,E$32,E$34,E$36,E$38,E$40,E$42,E$44,E$46,E$48,E$50,E$52,E$54,E$56,E$58,E$60,E$62,E$64,E$66,E$68,E$70,E$72,E$74,E$76,E$78,E$80,E$82,E$84,E$86,E$88,E$90,E$92,E$94,E$96,E$98,E$100,E$102,E$104,E$106,E$108,E$110,E$112,E$114,E$116,E$118,E$120,E$122,E$124)) -> 5 | F15: =RANK(F14,(F$6,F$8,F$10,F$12,F$14,F$16,F$18,F$20,F$22,F$24,F$26,F$28,F$30,F$32,F$34,F$36,F$38,F$40,F$42,F$44,F$46,F$48,F$50,F$52,F$54,F$56,F$58,F$60,F$62,F$64,F$66,F$68,F$70,F$72,F$74,F$76,F$78,F$80,F$82,F$84,F$86,F$88,F$90,F$92,F$94,F$96,F$98,F$100,F$102,F$104,F$106,F$108,F$110,F$112,F$114,F$116,F$118,F$120,F$122,F$124)) -> 4 | G15: =RANK(G14,(G$6,G$8,G$10,G$12,G$14,G$16,G$18,G$20,G$22,G$24,G$26,G$28,G$30,G$32,G$34,G$36,G$38,G$40,G$42,G$44,G$46,G$48,G$50,G$52,G$54,G$56,G$58,G$60,G$62,G$64,G$66,G$68,G$70,G$72,G$74,G$76,G$78,G$80,G$82,G$84,G$86,G$88,G$90,G$92,G$94,G$96,G$98,G$100,G$102,G$104,G$106,G$108,G$110,G$112,G$114,G$116,G$118,G$120,G$122,G$124)) -> 5 | H15: =RANK(H14,(H$6,H$8,H$10,H$12,H$14,H$16,H$18,H$20,H$22,H$24,H$26,H$28,H$30,H$32,H$34,H$36,H$38,H$40,H$42,H$44,H$46,H$48,H$50,H$52,H$54,H$56,H$58,H$60,H$62,H$64,H$66,H$68,H$70,H$72,H$74,H$76,H$78,H$80,H$82,H$84,H$86,H$88,H$90,H$92,H$94,H$96,H$98,H$100,H$102,H$104,H$106,H$108,H$110,H$112,H$114,H$116,H$118,H$120,H$122,H$124)) -> 5 | I15: =RANK(I14,(I$6,I$8,I$10,I$12,I$14,I$16,I$18,I$20,I$22,I$24,I$26,I$28,I$30,I$32,I$34,I$36,I$38,I$40,I$42,I$44,I$46,I$48,I$50,I$52,I$54,I$56,I$58,I$60,I$62,I$64,I$66,I$68,I$70,I$72,I$74,I$76,I$78,I$80,I$82,I$84,I$86,I$88,I$90,I$92,I$94,I$96,I$98,I$100,I$102,I$104,I$106,I$108,I$110,I$112,I$114,I$116,I$118,I$120,I$122,I$124)) -> 5 | J15: =RANK(J14,(J$6,J$8,J$10,J$12,J$14,J$16,J$18,J$20,J$22,J$24,J$26,J$28,J$30,J$32,J$34,J$36,J$38,J$40,J$42,J$44,J$46,J$48,J$50,J$52,J$54,J$56,J$58,J$60,J$62,J$64,J$66,J$68,J$70,J$72,J$74,J$76,J$78,J$80,J$82,J$84,J$86,J$88,J$90,J$92,J$94,J$96,J$98,J$100,J$102,J$104,J$106,J$108,J$110,J$112,J$114,J$116,J$118,J$120,J$122,J$124)) -> 5 | K15: =RANK(K14,(K$6,K$8,K$10,K$12,K$14,K$16,K$18,K$20,K$22,K$24,K$26,K$28,K$30,K$32,K$34,K$36,K$38,K$40,K$42,K$44,K$46,K$48,K$50,K$52,K$54,K$56,K$58,K$60,K$62,K$64,K$66,K$68,K$70,K$72,K$74,K$76,K$78,K$80,K$82,K$84,K$86,K$88,K$90,K$92,K$94,K$96,K$98,K$100,K$102,K$104,K$106,K$108,K$110,K$112,K$114,K$116,K$118,K$120,K$122,K$124)) -> 5 | L15: =RANK(L14,(L$6,L$8,L$10,L$12,L$14,L$16,L$18,L$20,L$22,L$24,L$26,L$28,L$30,L$32,L$34,L$36,L$38,L$40,L$42,L$44,L$46,L$48,L$50,L$52,L$54,L$56,L$58,L$60,L$62,L$64,L$66,L$68,L$70,L$72,L$74,L$76,L$78,L$80,L$82,L$84,L$86,L$88,L$90,L$92,L$94,L$96,L$98,L$100,L$102,L$104,L$106,L$108,L$110,L$112,L$114,L$116,L$118,L$120,L$122,L$124)) -> 5 | M15: =RANK(M14,(M$6,M$8,M$10,M$12,M$14,M$16,M$18,M$20,M$22,M$24,M$26,M$28,M$30,M$32,M$34,M$36,M$38,M$40,M$42,M$44,M$46,M$48,M$50,M$52,M$54,M$56,M$58,M$60,M$62,M$64,M$66,M$68,M$70,M$72,M$74,M$76,M$78,M$80,M$82,M$84,M$86,M$88,M$90,M$92,M$94,M$96,M$98,M$100,M$102,M$104,M$106,M$108,M$110,M$112,M$114,M$116,M$118,M$120,M$122,M$124)) -> 5 | N15: =RANK(N14,(N$6,N$8,N$10,N$12,N$14,N$16,N$18,N$20,N$22,N$24,N$26,N$28,N$30,N$32,N$34,N$36,N$38,N$40,N$42,N$44,N$46,N$48,N$50,N$52,N$54,N$56,N$58,N$60,N$62,N$64,N$66,N$68,N$70,N$72,N$74,N$76,N$78,N$80,N$82,N$84,N$86,N$88,N$90,N$92,N$94,N$96,N$98,N$100,N$102,N$104,N$106,N$108,N$110,N$112,N$114,N$116,N$118,N$120,N$122,N$124)) -> 5 | P15: =RANK(P14,(P$6,P$8,P$10,P$12,P$14,P$16,P$18,P$20,P$22,P$24,P$26,P$28,P$30,P$32,P$34,P$36,P$38,P$40,P$42,P$44,P$46,P$48,P$50,P$52,P$54,P$56,P$58,P$60,P$62,P$64,P$66,P$68,P$70,P$72,P$74,P$76,P$78,P$80,P$82,P$84,P$86,P$88,P$90,P$92,P$94,P$96,P$98,P$100,P$102,P$104,P$106,P$108,P$110,P$112,P$114,P$116,P$118,P$120,P$122,P$124)) -> 5